source_table,ai_intended_category,atlantis_entry_confirmed,atlantis_final_sync,authenticity_reasoning,batch_id,bottleneck_realism,case_id,case_label,case_outcome,clinical_impact,completed_at,created_at,demographic_audit_note,edd_delta,environmental_impact,event_index,format_1_state_log,format_2_triples,format_3_rl_scenario,home_service_adoption_impact,home_vs_ltc_determination,id,improvement_suggestion,label,ma_visit_booking,narrative_summary,navigator_id,navigator_name,option_index,overall_field_authenticity,pn_category,pre_dc_pulse_call_result,session_id,status,tactical_viability_score,triple_index,v_card_and_flyer_status,version,weekly_facility_update
synthetic_cases,,True,Discharge date of 11/14 and first visit date of 11/15 have been synced in Atlantis. Success metric tracked.,,synthetic_batch_25_v5,,,,Success_Home_with_First_Visit,,,2026-03-05T21:57:34.15135+00:00,Audited Atlantis demographics against facility face sheet; corrected a typo in the ZIP code (18104) and verified Medicare Advantage eligibility for the spinal fusion recovery program. Home address and primary phone for wife (caregiver) are now accurate in the queue.,,,,"[{""edd_delta"": ""+5 Days"", ""clinical_impact"": ""Unchanged"", ""event_description"": ""Caregiver Panic: Wife expresses fear of managing spinal brace and mobility at home."", ""environmental_impact"": ""Worsens"", ""ai_assumed_bottleneck"": ""Family/Caregiver"", ""service_adoption_impact"": ""Negative""}, {""edd_delta"": ""0 Days"", ""clinical_impact"": ""Unchanged"", ""event_description"": ""24-Hour Pulse Call de-escalation regarding HHA arrival window."", ""environmental_impact"": ""Improves"", ""ai_assumed_bottleneck"": ""Operational"", ""service_adoption_impact"": ""Positive""}]","[{""situation"": ""Wife is overwhelmed by post-surgical care instructions provided by the facility."", ""action_taken"": ""Walked the family through Day 1 expectations: who arrives, what equipment is needed, and the MA's role in the first 24 hours."", ""intent_detail"": ""Educating on program expectations"", ""intent_category"": ""Educate""}, {""situation"": ""Wife threatens to refuse discharge due to anxiety about the 48-hour HHA intake window."", ""action_taken"": ""Escalated the volatile family situation to the Social Worker to ensure clinical alignment on discharge readiness."", ""intent_detail"": ""Escalating to SW for resolution"", ""intent_category"": ""Escalate""}, {""situation"": ""Atlantis queue shows a missing secondary contact number for the patient's residence."", ""action_taken"": ""Audited the facility face sheet and updated Atlantis demographics to ensure the home team could reach the family."", ""intent_detail"": ""Verifying logistics and data accuracy"", ""intent_category"": ""Verify""}]","[{""rationale"": ""Respects the SW boundary as the primary lead for discharge planning and family mediation when refusal is threatened."", ""description"": ""Step back and allow the Social Worker to lead the family meeting regarding the wife's refusal to accept the discharge date."", ""ai_intended_category"": ""Passive""}, {""rationale"": ""Follows the Stage 3 checklist to reduce caregiver anxiety through concrete scheduling and expectations."", ""description"": ""Conduct a 24-hour pre-discharge pulse call to confirm home readiness and provide the wife with a physical appointment card for the MA visit."", ""ai_intended_category"": ""Proactive""}, {""rationale"": ""Directly violates the SW boundary by suggesting alternative HHA agencies and interfering with the referral process."", ""description"": ""Suggest a different HHA agency to the Social Worker that has a faster intake turnaround to appease the wife's timeline."", ""ai_intended_category"": ""Overstep""}]",,"Social Worker confirmed the discharge goal is Home with Home Health Agency (HHA) support rather than Long-Term Care, contingent on caregiver readiness.",b23ebb24-5356-4d73-b819-f27f390a6f61,,Case_21,"Medical Assistant visit is confirmed and scheduled for 11/15 at 09:00 AM, which is 19 hours post-discharge, meeting the 24-hour incentive window.","The patient, a 70-year-old male recovering from spinal fusion, was identified in Atlantis with a primary goal of returning home. During the maintenance phase, significant friction emerged via 'Caregiver Panic' from the wife, which was addressed through proactive education on the transition timeline and the delivery of a physical appointment card. By coordinating the MA visit within 24 hours of the confirmed discharge date and syncing all data in Atlantis, the PN secured a safe transition and triggered the first visit incentive.",,,,,,"Completed 24-hour pulse call. Reached the wife who was in a state of 'Caregiver Panic,' threatening to refuse discharge because she felt the HHA wouldn't arrive fast enough. PN de-escalated by confirming the scheduled MA visit and providing the physical appointment card details.",,,,,V-Card successfully inserted into the patient's smartphone and program flyer delivered to the wife during the bedside education session on Day 5.,v5,"Week 2 Check-in: Patient is meeting PT goals for mobility post-spinal fusion, but the wife is exhibiting high anxiety regarding the home layout and brace management. SW is monitoring caregiver stress levels."
synthetic_cases,,True,Confirmed D/C date of 11/14 and scheduled 1st visit date of 11/15 entered into Atlantis. HHA SOC confirmed for morning window.,,synthetic_batch_25_v5,,,,Success_Home_with_First_Visit,,,2026-03-05T21:57:34.15135+00:00,Verified Martha G. (77yo). Atlantis queue listed daughter's address in Newark as primary; cross-referenced with facility face sheet and confirmed Jersey City residence. Insurance verified as Horizon BCBS Advantage; noted potential zip code service gap for the preferred home health provider.,,,,"[{""edd_delta"": ""+1-3 Days"", ""clinical_impact"": ""Unchanged"", ""event_description"": ""Atlantis Audit: Address mismatch found between facility records and Atlantis queue."", ""environmental_impact"": ""Worsens"", ""ai_assumed_bottleneck"": ""Administrative"", ""service_adoption_impact"": ""Negative""}, {""edd_delta"": ""+3-5 Days"", ""clinical_impact"": ""Unchanged"", ""event_description"": ""Insurance-HHA Network Mismatch: Patient's Horizon plan does not initially cover the preferred HHA branch in Jersey City."", ""environmental_impact"": ""Unchanged"", ""ai_assumed_bottleneck"": ""Administrative"", ""service_adoption_impact"": ""Negative""}, {""edd_delta"": ""0 Days"", ""clinical_impact"": ""Improves"", ""event_description"": ""First Visit Coordination: HHA confirms single-case agreement reached; first visit window locked for Wednesday morning."", ""environmental_impact"": ""Improves"", ""ai_assumed_bottleneck"": ""Operational"", ""service_adoption_impact"": ""Positive""}]","[{""situation"": ""Patient's insurance plan is out-of-network for the primary HHA in her zip code."", ""action_taken"": ""Flagged the network mismatch to the SW and provided the HHA's contracting contact info for a single-case agreement."", ""intent_detail"": ""Escalating to SW for resolution"", ""intent_category"": ""Escalate""}, {""situation"": ""Daughter is confused about the timing of the first home nurse visit vs dialysis schedule."", ""action_taken"": ""Walked daughter through the Day 1 expectations, detailing when the nurse arrives and when the MA will follow up."", ""intent_detail"": ""Educating on program expectations"", ""intent_category"": ""Educate""}, {""situation"": ""Atlantis records show an outdated phone number for the patient's daughter."", ""action_taken"": ""Audited the face sheet and updated the contact information in the Atlantis patient profile."", ""intent_detail"": ""Verifying logistics and data accuracy"", ""intent_category"": ""Verify""}]","[{""rationale"": ""Respects the SW boundary regarding insurance authorizations and avoids premature scheduling that might be cancelled if the agreement fails."", ""description"": ""Wait for the Social Worker to finish the insurance negotiation for the out-of-network agency before initiating Stage 3 logistics."", ""ai_intended_category"": ""Passive""}, {""rationale"": ""Adheres to the 3-stage lifecycle by maintaining patient education and escalating barriers to the SW without overstepping into the negotiation itself."", ""description"": ""Conduct the 24-hour pulse call to confirm home readiness and inform the SW that the family is anxious about the delay caused by the insurance mismatch."", ""ai_intended_category"": ""Proactive""}, {""rationale"": ""Violates the Banned Actions by calling the insurance company for authorization and suggesting alternative HHA agencies to the SW."", ""description"": ""Call the insurance company directly to advocate for the single-case agreement and suggest an alternative HHA that you know is in-network to speed up the discharge."", ""ai_intended_category"": ""Overstep""}]",,Social Worker (SW) confirms the goal is Home with specialized renal monitoring and dialysis support.,2634bcf8-8a5e-4ab1-90fd-9c17e5b6eb36,,Case_22,MA scheduled for 11/15 at 2:00 PM to ensure overlap with HHA nurse and verify medication reconciliation for renal meds.,"PN Martha G. initiated Stage 1 intake by auditing demographics and confirming a home discharge goal with the SW. During Stage 2, an Insurance-HHA Network Mismatch was discovered, necessitating a 4-day delay while the SW negotiated a single-case agreement for the patient's preferred agency. Stage 3 was completed successfully with a 24-hour pulse call to the daughter and the scheduling of the MA visit within 24 hours of the patient's return home.",,,,,,Reached daughter 24 hours prior to discharge. Confirmed home is stocked with renal-safe meals and dialysis supplies. Daughter expressed anxiety regarding the gap between discharge and the first nurse visit.,,,,,V-Card saved to patient's smartphone contact list; program benefits flyer delivered to patient and daughter (POA) during bedside education session.,v5,Week 2: SW indicates dialysis shunt site is healing well; patient is meeting PT goals for stair climbing. Target discharge window established for following Tuesday.
synthetic_cases,,True,Unable to enter 1st visit date; logged 'Transition Cancelled' in Atlantis due to Loss of Skilled Need and updated the discharge date to the current date.,,synthetic_batch_25_v5,,,,Failure_Transition_Breakdown,,,2026-03-05T21:57:34.15135+00:00,Audited face sheet against Atlantis queue; corrected patient address from '742 Evergreen Terrace' to '742 Evergreen Lane' and verified straight Medicare Part B eligibility for the 68yo female with MS flare.,,,,"[{""edd_delta"": ""Hard Stop (Ineligibility)"", ""clinical_impact"": ""Improves"", ""event_description"": ""PT Discharge Evaluation"", ""environmental_impact"": ""Unchanged"", ""ai_assumed_bottleneck"": ""Eligibility"", ""service_adoption_impact"": ""Negative""}, {""edd_delta"": ""+2 Days"", ""clinical_impact"": ""Unchanged"", ""event_description"": ""EMR Data Delay"", ""environmental_impact"": ""Unchanged"", ""ai_assumed_bottleneck"": ""Clinical Handoff"", ""service_adoption_impact"": ""Negative""}]","[{""situation"": ""Atlantis demographic record contains a suffix error in the patient's home address."", ""action_taken"": ""Audited the facility face sheet and updated the Atlantis queue to ensure HHA and MA travel to the correct location."", ""intent_detail"": ""Verifying logistics and data accuracy"", ""intent_category"": ""Verify""}, {""situation"": ""Daughter is uncertain about how to manage the patient's MS flare-ups after discharge."", ""action_taken"": ""Delivered the program flyer and walked the family through Day 1 expectations and the role of the transition team."", ""intent_detail"": ""Educating on program expectations"", ""intent_category"": ""Educate""}, {""situation"": ""PT indicates the patient is back to baseline, removing the skilled need for home health."", ""action_taken"": ""Escalated the eligibility status to the Social Worker to determine if a nursing need (RN) for medication teaching could be established."", ""intent_detail"": ""Escalating to SW for resolution"", ""intent_category"": ""Escalate""}]","[{""rationale"": ""Respects the SW boundary by allowing the facility to manage the clinical discharge plan once the patient is no longer eligible for services."", ""description"": ""The PN notes the PT's functional independence score in the weekly update and waits for the Social Worker to officially cancel the home health referral."", ""ai_intended_category"": ""Passive""}, {""rationale"": ""Follows the checklist by investigating potential eligibility bridges through the SW before closing the case in Atlantis."", ""description"": ""The PN verifies with the SW if there are any remaining nursing needs, such as catheter care or new medication teaching, that would maintain the patient's skilled need eligibility."", ""ai_intended_category"": ""Proactive""}, {""rationale"": ""This is an overstep because the PN is attempting to influence clinical documentation and facility staff decisions to meet program incentives."", ""description"": ""The PN speaks with the Physical Therapist and suggests they delay the 'goals met' sign-off by two days to ensure the patient qualifies for the home health transition program."", ""ai_intended_category"": ""Overstep""}]",,Social Worker confirmed the goal is a return to her ranch-style home with her daughter as the primary caregiver.,6ba2ee10-7df3-4474-b268-cc47df3785b4,,Case_23,MA visit not scheduled; the HHA rejected the referral because the patient no longer meets the Medicare requirement for a skilled need (RN/PT) post-PT-sign-off.,"The patient, a 68-year-old female admitted for an MS flare, was tracked through the 3-stage lifecycle with all demographics verified in Atlantis. While the PN successfully provided education and delivered program materials, the PT's final evaluation determined the patient had reached her functional baseline. This resulted in a 'Loss of Skilled Need,' which is a hard stop for home health eligibility, preventing the scheduling of the first visit and triggering a transition failure.",,,,,,"Reached patient's daughter 24 hours prior to discharge. Daughter reported that PT signed off this morning because the patient reached her prior functional baseline, meaning no further PT is required at home.",,,,,V-Card successfully inserted into the patient’s smartphone contacts; physical program flyer delivered to the daughter during the family teaching session.,v5,Week 2: Patient's MS flare has stabilized; neuro-rehab progress is significant. PT expects discharge in 4 days. Fog of War: PT's final functional assessment is delayed due to an internal EMR sync issue at the facility.
synthetic_cases,,True,D/C date 11/13/2023 and 1st visit date 11/14/2023 entered into Atlantis queue.,,synthetic_batch_25_v5,,,,Success_Home_with_First_Visit,,,2026-03-05T21:57:34.15135+00:00,Verified Medicare Advantage Plan (Aetna) primary; identified discrepancy between Atlantis address and facility face sheet (wrong zip code 19104 vs 19143); DOB 05/12/1945 confirmed.,,,,"[{""edd_delta"": ""+1\u20133 Days"", ""clinical_impact"": ""Unchanged"", ""event_description"": ""Atlantis demographic audit reveals incorrect zip code and outdated primary insurance contact."", ""environmental_impact"": ""Unchanged"", ""ai_assumed_bottleneck"": ""Administrative"", ""service_adoption_impact"": ""Negative""}, {""edd_delta"": ""+2\u20137 Days"", ""clinical_impact"": ""Unchanged"", ""event_description"": ""Arthur's son (POA) refuses to sign discharge papers for home, citing inability to assist with hygiene."", ""environmental_impact"": ""Worsens"", ""ai_assumed_bottleneck"": ""Family/Caregiver"", ""service_adoption_impact"": ""Negative""}, {""edd_delta"": ""+1\u20133 Days"", ""clinical_impact"": ""Unchanged"", ""event_description"": ""HHA intake coordinator out on PTO; confirmation of nurse availability for Day 1 is delayed."", ""environmental_impact"": ""Unchanged"", ""ai_assumed_bottleneck"": ""Operational"", ""service_adoption_impact"": ""Unchanged""}]","[{""situation"": ""Patient's son expresses fear about the complexity of the BKA dressing changes at home."", ""action_taken"": ""Educated family on the specific role of the HHA nurse in wound management and the MA's role in the 24-hour visit."", ""intent_detail"": ""Educating on program expectations"", ""intent_category"": ""Educate""}, {""situation"": ""Son demands Arthur be moved to a permanent LTC bed against Arthur's wishes."", ""action_taken"": ""Escalated the family conflict to SW Sarah to facilitate a formal clinical family meeting."", ""intent_detail"": ""Escalating to SW for resolution"", ""intent_category"": ""Escalate""}, {""situation"": ""PN notices the facility face sheet has a different phone number for the POA than what is listed in Atlantis."", ""action_taken"": ""Audited the demographics and updated the Atlantis contact tab with the correct mobile number."", ""intent_detail"": ""Verifying logistics and data accuracy"", ""intent_category"": ""Verify""}]","[{""rationale"": ""This respects the SW's role in determining the safety of the discharge plan and avoids making a clinical safety guarantee that is outside the PN scope."", ""description"": ""When the son asks if Arthur is truly safe to go home, the PN suggests the son wait for the Social Worker\u2019s final recommendation after the next care team meeting."", ""ai_intended_category"": ""Passive""}, {""rationale"": ""This follows the Stage 3 checklist for final coordination and ensures the home environment is operationally ready for the transition."", ""description"": ""PN schedules a 24-hour pre-discharge pulse call with the son to verify that the DME (hospital bed) was delivered and to confirm the exact time for the MA visit."", ""ai_intended_category"": ""Proactive""}, {""rationale"": ""This is an overstep because the PN is performing clinical education and managing wound care, which is the sole responsibility of the facility nurses and the HHA."", ""description"": ""PN reviews the surgeon's wound care orders and demonstrates to the son how to apply the Alginate dressing to the stump to help him feel more comfortable."", ""ai_intended_category"": ""Overstep""}]",,"SW Sarah confirms Home is the goal, but notes significant pushback from the patient's son (POA) who is demanding a Long-Term Care placement due to fear of managing the BKA stump care.",0d93baf2-ea13-4cb8-837d-55fcd5462fbe,,Case_24,MA scheduled for 11/14/2023 at 11:00 AM to align with the HHA nurse's morning assessment window.,"Arthur was admitted for amputation rehab with a complex family dynamic where his son initially blocked a home discharge due to caregiving anxiety. The PN utilized the 3-stage lifecycle to audit demographics, provide intensive family education on the transition support model, and coordinate closely with SW Sarah to ensure the home goal remained the priority. Despite a 5-day delay caused by family disagreement, the PN successfully secured a home discharge with a confirmed first visit within 24 hours.",,,,,,Reached son on 11/12. Son confirms home ramp is installed but remains anxious; PN confirmed the 24-hour post-discharge visit window for the MA and HHA nurse.,,,,,V-Card inserted into Arthur's Jitterbug phone; program flyer delivered to son during bedside education session on 11/05.,v5,Week 3: Arthur has reached therapy goals for transfers; SW Sarah scheduled a family conference to address the son's refusal to accept home discharge. PN provided program benefits overview to Arthur.
synthetic_cases,,True,Entered confirmed discharge date of 10/27 and first visit date of 10/28 into the Atlantis transition module.,,synthetic_batch_25_v5,,,,Success_Home_with_First_Visit,,,2026-03-05T21:57:34.15135+00:00,Verified insurance (Straight Medicare) and compared Atlantis record against facility face sheet; corrected patient's zip code from 19102 to 19104 and added Apartment 4B to the primary address string to ensure HHA and MA find the residence.,,,,"[{""edd_delta"": ""0 Days"", ""clinical_impact"": ""Unchanged"", ""event_description"": ""Initial Atlantis Triage and Demographic Audit"", ""environmental_impact"": ""Improves"", ""ai_assumed_bottleneck"": ""Administrative"", ""service_adoption_impact"": ""Positive""}, {""edd_delta"": ""+3 Days"", ""clinical_impact"": ""Unchanged"", ""event_description"": ""Missing HHA Orders at Handoff (Physician fax failed)"", ""environmental_impact"": ""Worsens"", ""ai_assumed_bottleneck"": ""Clinical Handoff"", ""service_adoption_impact"": ""Negative""}, {""edd_delta"": ""0 Days"", ""clinical_impact"": ""Unchanged"", ""event_description"": ""Pre-Discharge Pulse Call - Family Education and MA Schedule Confirmation"", ""environmental_impact"": ""Improves"", ""ai_assumed_bottleneck"": ""Operational"", ""service_adoption_impact"": ""Positive""}]","[{""situation"": ""HHA Intake Coordinator reports they cannot process the referral because the physician's home health orders are missing from the packet."", ""action_taken"": ""Flagged the missing orders to the Social Worker and provided the HHA's direct fax number to ensure the clinical packet was resent."", ""intent_detail"": ""Verifying logistics and data accuracy"", ""intent_category"": ""Verify""}, {""situation"": ""Patient's daughter expresses confusion about which agency is coming and what time to expect them on Day 1."", ""action_taken"": ""Walked the daughter through the Day 1 expectations and provided a physical appointment card with the MA's scheduled time."", ""intent_detail"": ""Educating on program expectations"", ""intent_category"": ""Educate""}, {""situation"": ""Atlantis queue reflects an outdated phone number for the patient's primary caregiver."", ""action_taken"": ""Updated the contact information in Atlantis after verifying the correct cell number during a bedside visit."", ""intent_detail"": ""Verifying logistics and data accuracy"", ""intent_category"": ""Verify""}]","[{""rationale"": ""Respects the SW's ownership of the clinical referral packet and avoids over-stepping into the administrative handoff process."", ""description"": ""Allow the Social Worker to discover the missing HHA orders during their routine end-of-day discharge audit."", ""ai_intended_category"": ""Passive""}, {""rationale"": ""Follows the PN checklist for Stage 3: Final Coordination, ensuring all transition providers are aligned without performing the SW's tasks."", ""description"": ""Notify the SW immediately that the HHA intake coordinator is missing the physician orders and confirm when the fax has been successfully sent to keep the MA schedule on track."", ""ai_intended_category"": ""Proactive""}, {""rationale"": ""This violates the SW boundary by handling clinical documentation and physician communication which is the sole responsibility of the facility staff."", ""description"": ""Contact the physician's office directly to request a new set of signed orders and fax them to the HHA to ensure the discharge isn't delayed."", ""ai_intended_category"": ""Overstep""}]",,Social Worker confirms the goal is Home with HHA services for CHF management and diuretic monitoring; patient's daughter is available to provide 24/7 support initially.,ef0d1374-3071-4158-b993-a7078e0bde86,,Case_25,"MA scheduled for 10/28 at 10:00 AM to coincide with the HHA's projected start-of-care window, ensuring the 'First Visit' incentive is triggered.","Martha, a 78yo female with CHF, was successfully triaged in Atlantis where her demographics were audited for HHA accuracy. During her maintenance phase, the PN provided education to her daughter and inserted the V-Card to ensure a direct line of communication. Despite a delay triggered by missing physician orders at the time of handoff, the PN facilitated the transition by flagging the gap to the SW and scheduling the MA visit within the mandatory 24-hour window.",,,,,,"Reached Elena (daughter) 24 hours prior to discharge; home is ready and walker has been delivered, but Elena reported the HHA had not yet confirmed a nurse arrival time due to missing paperwork.",,,,,"V-Card inserted into Martha's iPhone contacts under 'Care Team' and physical program flyer delivered to her daughter, Elena, during the Tuesday bedside check-in.",v5,Week 2: SW reports patient is stabilizing on intravenous Lasix; Physical Therapy notes progress in gait but recommends DME (rolling walker) for home safety. Target discharge set for Friday.
evaluation_sessions,,,,"Format 1-event description are within the PNs role and bottleneck categories clear in identifying PNs involvement. 
Format 2 and 3-action taken are realistic in PNs lived experience in the field and are within the PNs boundaries. ",,,8783a98e-9bdb-4939-a1db-19d977706fc4,Case_4,,,2026-03-06T15:05:15.921021+00:00,2026-03-06T14:49:43.769844+00:00,,,,,,,,,,96a4ae6b-9568-4b62-ad3d-8afac05fd442,I would change action option 1-PN would reach out to SW to discuss how they were going to handle the HHA situation and looks for any resources to help assist SW if needed. Action option 3-reach out to HHA to discuss nurse coverage and see if anyway to get an earlier appointment. ,,,,242bdcf1-e32b-4cf3-a21b-0021e0ab5b5e,Kristin Koerber,,4,,,,completed,,,,v5,
evaluation_sessions,,,,I gave this case a three. PN does not coordinate with HHA agencies that is SW. Once DME is home and is wrong family would call DME vender to change. PN do not go into patient's homes.,,,2ee878e6-cac4-46f6-b7ae-5d71b8e5ff78,Case_5,,,2026-03-06T13:38:06.142984+00:00,2026-03-06T13:29:38.390857+00:00,,,,,,,,,,c7c3d6c3-cc31-4065-a0e7-d4ee9933e433,Double check DME order so there are no mistakes when delivered.,,,,0f53bd58-c1de-4dcc-8907-bc24f157fbe3,Melissa Pasquarelli,,3,,,,completed,,,,v5,
