source_table,ai_intended_category,atlantis_entry_confirmed,atlantis_final_sync,authenticity_reasoning,batch_id,bottleneck_realism,case_id,case_label,case_outcome,clinical_impact,completed_at,created_at,demographic_audit_note,edd_delta,environmental_impact,event_index,format_1_state_log,format_2_triples,format_3_rl_scenario,home_service_adoption_impact,home_vs_ltc_goal,id,improvement_suggestion,label,narrative_summary,navigator_id,navigator_name,option_index,overall_field_authenticity,pn_category,pre_dc_pulse_call,role_delineation_check,session_id,status,tactical_viability_score,triple_index,v_card_flyer_status,version
synthetic_cases,,True,"Once the Social Worker verbally confirmed that the home health agency had accepted the case and set a date, I recorded the discharge date and the scheduled first visit for our Medical Assistant in Atlantis.",,synthetic_batch_25_v13,,,,Success_Home_with_First_Visit,,,2026-03-25T12:40:36.824045+00:00,I reviewed the facility face sheet against the Atlantis record and discovered that Elena's primary phone number was missing a digit; I corrected this in Atlantis to ensure the home health agency and our team can maintain contact during the transition. I also verified her suburban address to confirm it is within the Medical Assistant's service area.,,,,"[{""edd_delta"": ""None"", ""clinical_impact"": ""Unchanged"", ""event_description"": ""The Navigator was assigned to Elena's case and conducted an initial chart audit in Atlantis, noting her history of multiple sclerosis and current mobility limitations."", ""environmental_impact"": ""Unchanged"", ""ai_assumed_bottleneck"": ""Initial Intake"", ""service_adoption_impact"": ""Positive""}, {""edd_delta"": ""+1 to 3 Days"", ""clinical_impact"": ""Unchanged"", ""event_description"": ""The Navigator learned from the family that a discharge meeting had occurred earlier that morning without their notification or inclusion; the Social Worker was unavailable for an immediate update."", ""environmental_impact"": ""Worsens"", ""ai_assumed_bottleneck"": ""Liaison Communication Silo"", ""service_adoption_impact"": ""Negative""}, {""edd_delta"": ""+2 to 5 Days"", ""clinical_impact"": ""Unchanged"", ""event_description"": ""The Navigator met with the Social Worker to request a summary of the transition plan; the Social Worker confirmed that the home health agency is still being finalized and the discharge date has been pushed back due to the missed coordination."", ""environmental_impact"": ""Improves"", ""ai_assumed_bottleneck"": ""Home Health Agency Acceptance Stall"", ""service_adoption_impact"": ""Positive""}, {""edd_delta"": ""None"", ""clinical_impact"": ""Improves"", ""event_description"": ""The Social Worker called to confirm that the agency is in place for a Friday discharge; the Navigator documented the date in Atlantis and informed the family of the Medical Assistant's arrival window for Saturday morning."", ""environmental_impact"": ""Improves"", ""ai_assumed_bottleneck"": ""None"", ""service_adoption_impact"": ""Positive""}]","[{""situation"": ""The Navigator was excluded from the facility's weekly discharge huddle."", ""action_taken"": ""I requested a verbal status update from the Social Worker to ensure the transition plan in Atlantis reflected the most recent clinical decisions."", ""intent_category"": ""Verify""}, {""situation"": ""Elena's daughter expressed significant frustration and anxiety regarding the changing discharge timeline."", ""action_taken"": ""I documented the family's concerns in Atlantis and alerted the Social Worker that a direct conversation with the family was needed to address their anxiety."", ""intent_category"": ""Flag""}, {""situation"": ""The family was unclear about who would be visiting the home after Elena left the facility."", ""action_taken"": ""I explained the role of the Medical Assistant and the importance of the first visit within the twenty-four-hour window post-discharge."", ""intent_category"": ""Educate""}]","[{""rationale"": ""This respects the Social Worker's ownership of the discharge process and avoids interrupting their clinical workflow while maintaining a clear record of the information gap."", ""description"": ""The Navigator notes that they have not received an update from the Social Worker regarding the morning's planning meeting. They document the lack of information in Atlantis and wait for the Social Worker's scheduled afternoon rounds to ask for a summary."", ""ai_intended_category"": ""Passive""}, {""rationale"": ""This action remains within the Navigator's lane by facilitating communication and ensuring data accuracy without attempting to influence the clinical or vendor selection process."", ""description"": ""The Navigator approaches the Social Worker directly to ask for a status update on the home health agency referral. They then meet with the family to verify that the contact information in Atlantis is correct and explain how the Healing Partners program will assist them once the agency is confirmed."", ""ai_intended_category"": ""Proactive""}, {""rationale"": ""This violates the No-Vendor Rule and improperly shares clinical or operational details with the family that should come directly from the Social Worker or the agency itself."", ""description"": ""The Navigator calls the home health agency's intake department to ask why the referral hasn't been accepted yet and then tells the family that the delay is due to the agency's staffing shortage."", ""ai_intended_category"": ""Overstep""}]",,Home with Home Health Services,760eef5c-975c-44db-a68a-3e5df172da15,,Case_20,"Elena Vance, a 68-year-old patient recovering from a multiple sclerosis flare, faced significant uncertainty when a discharge planning meeting was held without the Navigator's presence. This communication gap meant the patient and her family were left without clear instructions on the next steps for her home care transition. The Navigator acted as a supportive liaison by seeking a direct update from the Social Worker, documenting the new timeline in Atlantis, and ensuring Elena's family understood how the Medical Assistant would support her first day back at home.",,,,,,"I reached the family twenty-four hours before the scheduled discharge; while they are eager to get Elena home, they expressed anxiety about the lack of recent updates from the facility staff. I documented this sentiment in Atlantis and alerted the Social Worker to their concerns.","The Social Worker is responsible for selecting the home health agency and finalizing the clinical discharge plan, while the Navigator focuses on auditing demographic data in Atlantis, educating the family on the transition program, and flagging any communication gaps or family concerns back to the Social Worker.",,,,,"I sat with Elena and her daughter to explain the Healing Partners program and provided them with the program flyer. I successfully helped the daughter save our digital contact card to her phone, explaining that this would help her recognize our calls as her mother transitions home.",v13
synthetic_cases,,True,"The Navigator updated Atlantis with the discharge date provided by the social worker and noted that while the medical assistant is prepared for the first visit, the family's verbal confirmation is still pending.",,synthetic_batch_25_v13,,,,Failure_Transition_Breakdown,,,2026-03-25T12:40:36.824045+00:00,"During the initial audit, the Navigator compared the facility face sheet to the Atlantis record and discovered the primary home phone number was transposed; the Navigator corrected the contact information in Atlantis to ensure the home team could reach the patient.",,,,"[{""edd_delta"": ""None"", ""clinical_impact"": ""Unchanged"", ""event_description"": ""The Navigator met with Arthur and his wife to explain how the medical assistant would support his COPD management during the first 24 hours at home; the family expressed initial comfort with the plan."", ""environmental_impact"": ""Improves"", ""ai_assumed_bottleneck"": ""None"", ""service_adoption_impact"": ""Positive""}, {""edd_delta"": ""+2\u20135 Days"", ""clinical_impact"": ""Unchanged"", ""event_description"": ""The Social Worker informed the Navigator that the home health agency had accepted the referral but was still finalizing the nursing schedule; the Navigator documented this status in Atlantis and waited for further updates."", ""environmental_impact"": ""Unchanged"", ""ai_assumed_bottleneck"": ""HHA_Acceptance_Stall"", ""service_adoption_impact"": ""Positive""}, {""edd_delta"": ""+1\u20132 Days"", ""clinical_impact"": ""Worsens"", ""event_description"": ""During the mandatory pre-discharge window, the Navigator's calls to the family went unanswered, preventing the confirmation of the first-visit time; the Navigator alerted the Social Worker to this communication gap."", ""environmental_impact"": ""Worsens"", ""ai_assumed_bottleneck"": ""Pre-DC_Call_Disconnect"", ""service_adoption_impact"": ""Negative""}]","[{""situation"": ""The patient's wife asked specific questions regarding the frequency of oxygen tank refills and nebulizer maintenance."", ""action_taken"": ""The Navigator explained that these were excellent clinical questions for the social worker and the home health nurse and noted the concern in Atlantis."", ""intent_category"": ""Flag""}, {""situation"": ""The patient was unsure how to identify the Healing Partners representative calling his home."", ""action_taken"": ""The Navigator walked the patient through the process of adding the digital v-card to his contacts to ensure the caller ID would be recognized."", ""intent_category"": ""Educate""}, {""situation"": ""The Navigator noted a discrepancy between the discharge date mentioned by the patient and the date in the facility records."", ""action_taken"": ""The Navigator asked the social worker for a verbal confirmation of the official discharge timeline to ensure Atlantis was accurate."", ""intent_category"": ""Verify""}]","[{""rationale"": ""This respects the boundary that the social worker owns the discharge coordination and avoids the Navigator stepping into vendor or logistics management without new information."", ""description"": ""After failing to reach the family for the 24-hour check, the Navigator documents the unanswered calls and the date in Atlantis, then waits for the social worker to provide an update or for the family to return the call."", ""ai_intended_category"": ""Passive""}, {""rationale"": ""This action remains within the Navigator's lane of verifying demographics and maintaining communication with the social worker without contacting outside agencies."", ""description"": ""The Navigator visits Arthur's room before he leaves the facility to confirm the family's contact details in person and asks the social worker if an alternative phone number was provided during the morning rounds."", ""ai_intended_category"": ""Proactive""}, {""rationale"": ""This is an overstep because it violates the no-vendor rule and attempts to manage logistics that are the sole responsibility of the social worker and the agency."", ""description"": ""The Navigator calls the home health agency's intake coordinator to see if they have a different phone number for the wife or if they have already scheduled the first nursing visit for the COPD follow-up."", ""ai_intended_category"": ""Overstep""}]",,Home with Home Health Agency support,11d5a2a6-9d71-48a7-980c-8c1cba189a64,,Case_21,"Arthur Miller, a 65-year-old recovering from a severe COPD exacerbation, encountered a significant hurdle during his transition from the facility to his home. Despite his clinical progress, a critical disconnect occurred when his primary caregiver could not be reached for the mandatory 24-hour pre-discharge check, leaving the timing of his initial home support unverified. The Navigator acted as a liaison by documenting this silence in Atlantis and alerting the social worker to the risk of an uncoordinated arrival at home.",,,,,,The Navigator attempted the 24-hour pre-discharge pulse call multiple times but was unable to reach Arthur's wife; this lack of confirmation regarding home readiness was documented in Atlantis and shared with the social worker.,"The social worker is responsible for securing the home health agency and coordinating the medical transport, whereas the Navigator focuses on auditing demographic accuracy in Atlantis, educating Arthur on the transition process, and flagging any communication gaps that might prevent a successful first home visit.",,,,,The Navigator visited Arthur's room to deliver the program flyer and assisted him in saving the Healing Partners digital contact card to his phone so he would recognize the caller ID for his upcoming appointments.,v13
synthetic_cases,,True,"Once the social worker verbally confirmed that the home health agency had accepted the case for a Tuesday start-of-care, the Navigator recorded the discharge date and the scheduled first visit for the Medical Assistant in the Atlantis system.",,synthetic_batch_25_v13,,,,Success_Home_with_First_Visit,,,2026-03-25T12:40:36.824045+00:00,The Navigator cross-referenced the facility face sheet against the Atlantis record and discovered that Arthur's primary contact number was listed incorrectly; the Navigator updated the phone number in Atlantis and confirmed the correct home address to ensure the home team would have accurate logistics for the first visit.,,,,"[{""edd_delta"": ""+2\u20135 Days"", ""clinical_impact"": ""Worsens"", ""event_description"": ""The Social Worker notified the Navigator that the home health agency is currently on a holiday intake freeze, which will delay the start of home services until after the long weekend; the Navigator documented this delay in the Atlantis timeline."", ""environmental_impact"": ""Unchanged"", ""ai_assumed_bottleneck"": ""Holiday Coverage Gap"", ""service_adoption_impact"": ""Negative""}, {""edd_delta"": ""0 Days"", ""clinical_impact"": ""Unchanged"", ""event_description"": ""The Navigator met with the patient's daughter to explain the Healing Partners program and the specific support the Medical Assistant provides during the first 24 hours after discharge, helping to manage expectations during the holiday delay."", ""environmental_impact"": ""Unchanged"", ""ai_assumed_bottleneck"": ""None"", ""service_adoption_impact"": ""Positive""}, {""edd_delta"": ""0 Days"", ""clinical_impact"": ""Improves"", ""event_description"": ""The Social Worker provided a verbal update that the agency has assigned a nurse for Tuesday morning; the Navigator documented the confirmed start-of-care date in Atlantis and alerted the home team to finalize the Medical Assistant's schedule."", ""environmental_impact"": ""Unchanged"", ""ai_assumed_bottleneck"": ""None"", ""service_adoption_impact"": ""Positive""}]","[{""situation"": ""The home health agency was unavailable for intake over the holiday weekend."", ""action_taken"": ""Noted the communication gap in Atlantis and alerted the Social Worker to the family's concern about the care delay."", ""intent_category"": ""Flag""}, {""situation"": ""The family was unsure about the difference between the home health nurse and the Healing Partners team."", ""action_taken"": ""Educated the daughter on the specific 24-hour post-discharge window and the role of the Medical Assistant."", ""intent_category"": ""Educate""}, {""situation"": ""The patient's address in the system was missing the apartment number."", ""action_taken"": ""Updated the demographic records in Atlantis after reviewing the facility's official face sheet."", ""intent_category"": ""Verify""}]","[{""rationale"": ""This respects the boundary that the Social Worker owns the discharge timeline and the relationship with the home health agency, preventing the Navigator from interfering in vendor logistics."", ""description"": ""The Navigator notes that the Social Worker has not yet provided a confirmed start-of-care date due to the holiday weekend; the Navigator documents the waiting status and the date in Atlantis and waits for the next verbal update from the facility team."", ""ai_intended_category"": ""Passive""}, {""rationale"": ""This allows the Navigator to gather necessary information and support the family's emotional readiness without crossing into clinical or vendor management."", ""description"": ""The Navigator asks the Social Worker for a verbal status update regarding the agency's holiday schedule and simultaneously conducts a pulse call to the family to confirm they are comfortable with the plan, documenting the daughter's anxiety in Atlantis for the Social Worker's review."", ""ai_intended_category"": ""Proactive""}, {""rationale"": ""This is an overstep because it violates the No-Vendor Rule and involves the Navigator in clinical education, which is the responsibility of the facility nurses and the home health agency."", ""description"": ""The Navigator calls the home health agency's intake department directly to see if they can make an exception for a Saturday admission and then explains to the family how to change Arthur's post-operative surgical dressings during the holiday gap."", ""ai_intended_category"": ""Overstep""}]",,Home with home health services,e018b40b-82c8-45d4-9378-4f8f1a2012d4,,Case_22,"Arthur Miller, a 75-year-old patient recovering from cardiac bypass surgery, encountered a transition barrier when his discharge timeline coincided with a major holiday weekend. The social worker informed the Navigator that the selected home health agency was operating on a reduced schedule and could not perform an intake until the following Tuesday, creating a three-day gap in post-discharge monitoring. The Navigator acted as a supportive liaison by documenting this delay in Atlantis and spending time with Arthur's daughter to explain how the Healing Partners program would bridge the care gap once the holiday concluded. By maintaining a close feedback loop with the social worker, the Navigator successfully confirmed the first visit window and ensured Arthur returned home with a clear plan for his recovery.",,,,,,"During the 24-hour pulse call, the daughter expressed significant anxiety regarding the holiday weekend gap in nursing care; the Navigator documented this sentiment in Atlantis and encouraged the daughter to discuss her specific clinical concerns directly with the social worker.","The Social Worker is responsible for managing the home health agency referral and negotiating the start-of-care date around the holiday staffing shortage, while the Navigator focuses on verifying Arthur's demographic data in Atlantis, educating the family on the Medical Assistant's role, and flagging the holiday-related scheduling gap for the clinical team's awareness.",,,,,The Navigator provided Arthur and his daughter with the program flyer and assisted the daughter in saving the Healing Partners V-Card to her mobile phone so she would recognize the caller ID for all future coordination calls.,v13
synthetic_cases,,True,"The Navigator documented the final decision in Atlantis, recording the shift to long-term care and noting that the case is closed with no home visits or medical assistant scheduling required.",,synthetic_batch_25_v13,,,,Neutral_LTC_Closure,,,2026-03-25T12:40:36.824045+00:00,"The Navigator audited the facility face sheet against the Atlantis record and found that the patient's primary residence was listed as his daughter's address, but the zip code was missing the final digit; this was corrected in the system to ensure the Medical Assistant travel radius was properly calculated before the plan shifted.",,,,"[{""edd_delta"": ""+2-7 Days"", ""clinical_impact"": ""Unchanged"", ""event_description"": ""The Navigator met with Arthur and his daughter to discuss the transition program; the daughter was visibly shaken and shared that she did not feel capable of managing her father's dementia symptoms at home."", ""environmental_impact"": ""Worsens"", ""ai_assumed_bottleneck"": ""Significant caregiver panic regarding the patient's cognitive safety at home."", ""service_adoption_impact"": ""Negative""}, {""edd_delta"": ""+1-3 Days"", ""clinical_impact"": ""Unchanged"", ""event_description"": ""The Navigator asked the Social Worker for an update on the discharge planning status after the family expressed interest in permanent placement; the Social Worker confirmed a care conference was pending to discuss the pivot."", ""environmental_impact"": ""Unchanged"", ""ai_assumed_bottleneck"": ""Waiting for the social worker to finalize the care conference results."", ""service_adoption_impact"": ""Unchanged""}, {""edd_delta"": ""Hard Stop (LTC Closure)"", ""clinical_impact"": ""Improves"", ""event_description"": ""The Social Worker notified the Navigator that the family has officially opted for long-term care instead of returning home; the Navigator documented the update and performed a neutral closure in Atlantis."", ""environmental_impact"": ""Improves"", ""ai_assumed_bottleneck"": ""The transition to long-term care has been finalized, ending the home health referral process."", ""service_adoption_impact"": ""Negative""}]","[{""situation"": ""The patient's daughter expresses high levels of anxiety about managing Arthur's wandering behaviors and fall risks at home."", ""action_taken"": ""The Navigator documented the daughter's safety concerns and high anxiety levels in Atlantis to ensure a clear record of the family's sentiment."", ""intent_category"": ""Flag""}, {""situation"": ""The family asks if the Healing Partners program can provide a full-time live-in aide to prevent falls."", ""action_taken"": ""The Navigator explained the program's focus on transitional medical assistant visits and directed the family to the Social Worker for questions regarding long-term private duty care."", ""intent_category"": ""Educate""}, {""situation"": ""The Navigator noticed a discrepancy between the patient's phone number on the face sheet and the Atlantis record."", ""action_taken"": ""The Navigator verified the correct contact number with the daughter and updated the patient profile in Atlantis."", ""intent_category"": ""Verify""}]","[{""rationale"": ""This respects the Social Worker's ownership of the discharge plan and avoids making assumptions about the patient's destination before it is officially confirmed."", ""description"": ""The Navigator noted in Atlantis that the Social Worker had not yet shared the final outcome of the family care conference and chose to wait for a direct verbal update before taking any further action."", ""ai_intended_category"": ""Passive""}, {""rationale"": ""This allows the Navigator to maintain an accurate record of the transition barriers while ensuring they are receiving information through the correct professional channels."", ""description"": ""The Navigator asked the Social Worker for a status update on the discharge destination and updated the Atlantis timeline to reflect that the family was currently being evaluated for a long-term care pivot."", ""ai_intended_category"": ""Proactive""}, {""rationale"": ""This is an overstep because the Navigator is interfering with facility financial and placement logistics, which are the exclusive responsibility of the Social Worker and the administrative team."", ""description"": ""The Navigator contacted the facility's business office to ask about the daily rate for a long-term care bed so they could provide financial options to the family during their next visit."", ""ai_intended_category"": ""Overstep""}]",,The Social Worker confirmed that the discharge goal has changed to permanent Long-Term Care due to the patient's safety needs and dementia progression.,68a54b18-6153-477e-9a2d-1275702bc6b7,,Case_23,"Arthur Vance, an 86-year-old gentleman with advancing dementia and a history of repeated falls, was initially planned for a home discharge following his rehabilitation for a hip fracture. During a bedside visit, his daughter expressed overwhelming fear regarding her father's cognitive decline and the risk of him wandering at night without professional supervision. After the Social Worker coordinated a family meeting to discuss these safety concerns, the plan was officially changed from a home transition to a permanent placement in the facility's long-term care wing. The Navigator supported the process by documenting the family's shifting sentiment in Atlantis and finalized the case as a neutral closure once the home health referral was discontinued.",,,,,,"During a final touchpoint, the daughter confirmed that the family had reached a consensus with the Social Worker to transition Arthur to long-term care, noting that their anxiety regarding home safety had reached a breaking point.","The Social Worker is responsible for facilitating the family care conference and making the final clinical determination for a long-term care pivot, whereas the Navigator's role is restricted to documenting the family's transition anxiety in Atlantis, verifying demographic accuracy, and performing a neutral closure once the home-based goal is abandoned.",,,,,"The Navigator provided the daughter with a program flyer and successfully helped her save the Healing Partners contact card to her phone, explaining that this would allow her to recognize the program's caller identification if they needed to coordinate future services.",v13
