source_table,ai_intended_category,atlantis_entry_confirmed,atlantis_final_sync,authenticity_reasoning,batch_id,bottleneck_realism,case_id,case_label,case_outcome,clinical_impact,completed_at,created_at,demographic_audit_note,edd_delta,environmental_impact,event_index,format_1_state_log,format_2_triples,format_3_rl_scenario,home_service_adoption_impact,home_vs_ltc_determination,id,improvement_suggestion,label,ma_visit_booking,narrative_summary,navigator_id,navigator_name,option_index,overall_field_authenticity,pn_category,pre_dc_pulse_call_result,session_id,status,tactical_viability_score,triple_index,v_card_and_flyer_status,version,weekly_facility_update
synthetic_cases,,True,Entered confirmed discharge date of 11/14 and scheduled first visit for 11/15 into Atlantis.,,synthetic_batch_25_v5,,,,Success_Home_with_First_Visit,,,2026-03-05T21:57:34.15135+00:00,"Audit of Atlantis queue against facility face sheet for Arthur M. (79yo M, Left BKA). Verified Humana Gold Plus (Medicare Advantage) eligibility. Identified discrepancy in primary contact phone number; updated Atlantis to reflect the daughter's (POA) current mobile number.",,,,"[{""edd_delta"": ""N/A"", ""clinical_impact"": ""Unchanged"", ""event_description"": ""Initial Atlantis Audit"", ""environmental_impact"": ""Unchanged"", ""ai_assumed_bottleneck"": ""Administrative"", ""service_adoption_impact"": ""Positive""}, {""edd_delta"": ""+1\u20133 Days"", ""clinical_impact"": ""Worsens"", ""event_description"": ""Discovery of Handoff_Data_Mismatch (Medication List)"", ""environmental_impact"": ""Unchanged"", ""ai_assumed_bottleneck"": ""Clinical Handoff"", ""service_adoption_impact"": ""Negative""}, {""edd_delta"": ""0 Days"", ""clinical_impact"": ""Improves"", ""event_description"": ""MA Visit Booking Confirmation"", ""environmental_impact"": ""Unchanged"", ""ai_assumed_bottleneck"": ""Operational"", ""service_adoption_impact"": ""Positive""}]","[{""situation"": ""Patient's phone number in Atlantis does not match the facility face sheet."", ""action_taken"": ""Updated Atlantis demographics to ensure the HHA and home team have the correct POA contact info."", ""intent_detail"": ""Verifying logistics and data accuracy"", ""intent_category"": ""Verify""}, {""situation"": ""HHA intake coordinator has an outdated medication profile during the 24-hour pulse call."", ""action_taken"": ""Flagged the discrepancy to the Social Worker and requested a corrected discharge summary be re-faxed to the agency."", ""intent_detail"": ""Escalating to SW for resolution"", ""intent_category"": ""Escalate""}, {""situation"": ""Daughter is concerned about the timing of the first home visit."", ""action_taken"": ""Provided a physical appointment card and explained that the MA and Nurse would arrive within 24 hours of him getting home."", ""intent_detail"": ""Educating on program expectations"", ""intent_category"": ""Educate""}]","[{""rationale"": ""Respects the SW's role in clinical documentation but risks a service delay or medication error if the SW misses the mismatch during the busy discharge window."", ""description"": ""Wait for the Social Worker to notice the medication list discrepancy during their final discharge meeting with the patient."", ""ai_intended_category"": ""Passive""}, {""rationale"": ""Follows the Stage 3 Handoff checklist by verifying handoff data and escalating clinical mismatches to the appropriate professional (SW) without overstepping into clinical management."", ""description"": ""Identify the specific medication discrepancies during the pulse call and immediately alert the SW to ensure the HHA receives the correct orders before the patient leaves."", ""ai_intended_category"": ""Proactive""}, {""rationale"": ""While ensuring accuracy, this violates the SW Boundary and Banned Actions by managing medications and touching clinical documentation, which is strictly outside the PN scope."", ""description"": ""Directly call the patient's surgeon to verify the current anticoagulant dosage and then call the HHA nurse to verbally update the medication administration record."", ""ai_intended_category"": ""Overstep""}]",,Social Worker confirmed the goal is Home with HHA services for wound care and PT. Patient has a stable environment with a ramp already installed.,27d29aee-c325-40ea-8b98-0dcf56b8e888,,Case_11,"Medical Assistant scheduled for 11/15 at 10:00 AM, following the HHA Start of Care window to ensure the 24-hour incentive trigger is met.","The patient, a 79-year-old male recovering from a Left BKA, was monitored through a 14-day rehab stay. During the handoff stage, a pulse call revealed that the HHA possessed an outdated medication list, which the PN immediately flagged to the Social Worker for reconciliation. Despite this data mismatch, the PN successfully coordinated the HHA and MA schedules, ensuring the first visit occurred within 24 hours of discharge.",,,,,,"Conducted 24-hour pre-discharge pulse call to daughter. Discovered a critical 'Handoff_Data_Mismatch' where the HHA intake record still listed the patient's pre-surgical medication list, missing the new post-amputation anticoagulants.",,,,,Program flyer delivered to patient's bedside and V-Card successfully saved to the patient's personal smartphone contacts under 'Home Care Support'.,v5,Week 2: Patient meeting PT goals for prosthetic gait training. SW indicates tentative discharge for Friday. PN provided education on the 24-hour first visit requirement to the patient and daughter.
synthetic_cases,,True,Entered D/C date of 11/15 and 1st visit date of 11/16 into Atlantis based on the Social Worker's verbal discharge plan.,,synthetic_batch_25_v5,,,,Failure_Transition_Breakdown,,,2026-03-05T21:57:34.15135+00:00,Audited Atlantis demographics against facility face sheet; corrected error in patient ZIP code and added missing secondary phone number for the daughter (POA). Verified Medicare Advantage Plan coverage for home health.,,,,"[{""edd_delta"": ""0 Days"", ""clinical_impact"": ""Improves"", ""event_description"": ""Weekly alignment with SW regarding wound healing progress."", ""environmental_impact"": ""Unchanged"", ""ai_assumed_bottleneck"": ""Operational"", ""service_adoption_impact"": ""Positive""}, {""edd_delta"": ""+1\u20132 Days"", ""clinical_impact"": ""Unchanged"", ""event_description"": ""Mandatory 24-hour pre-discharge pulse call failed; POA unreachable."", ""environmental_impact"": ""Worsens"", ""ai_assumed_bottleneck"": ""Operational"", ""service_adoption_impact"": ""Negative""}]","[{""situation"": ""Atlantis demographics missing daughter's secondary contact number."", ""action_taken"": ""Audited facility face sheet and updated Atlantis record to ensure reachability."", ""intent_detail"": ""Verifying logistics and data accuracy"", ""intent_category"": ""Verify""}, {""situation"": ""Patient's daughter expresses anxiety about managing diabetic wound dressings at home."", ""action_taken"": ""Conducted bedside education walking the family through Day 1 expectations and MA support."", ""intent_detail"": ""Educating on program expectations"", ""intent_category"": ""Educate""}, {""situation"": ""PN cannot reach family 24 hours before discharge to confirm the MA schedule."", ""action_taken"": ""Escalated the communication gap to the Social Worker to ensure the visit time is relayed during discharge paperwork."", ""intent_detail"": ""Escalating to SW for resolution"", ""intent_category"": ""Escalate""}]","[{""rationale"": ""Respects the HHA's responsibility for intake coordination but risks missing the 24-hour incentive window if the HHA is also delayed."", ""description"": ""Wait for the Home Health Agency intake coordinator to confirm they have successfully contacted the family before finalizing the MA schedule in Atlantis."", ""ai_intended_category"": ""Passive""}, {""rationale"": ""Complies with the PN checklist Stage 3 by using the SW as the primary facility channel to bridge the communication gap without overstepping."", ""description"": ""Flag the unreachable POA to the Social Worker and request they verify the 09:00 AM MA visit time with the family during the physical discharge handoff."", ""ai_intended_category"": ""Proactive""}, {""rationale"": ""Directly violates the SW Boundary and Banned Actions by contacting insurance companies for administrative data that should be managed by the facility staff."", ""description"": ""Call the patient's insurance provider to request an alternate emergency contact number or to verify if the patient has a secondary residence listed in their file."", ""ai_intended_category"": ""Overstep""}]",,Social Worker confirmed the goal is Home with skilled nursing for diabetic wound care and PT for gait training; patient's daughter is available to assist with ADLs.,b5ad3956-c3c0-440e-8385-4e7b250388fd,,Case_12,Medical Assistant (MA) scheduled for 11/16 at 09:00 AM; visit status marked as 'Pending Confirmation' due to failed pulse call reach.,"A 69yo female with a diabetic wound was triaged in Atlantis for a home transition. The PN completed Stage 1 audits and Stage 2 education, ensuring the V-Card was installed. However, a Stage 3 Pre-DC pulse call disconnect prevented verification of the MA visit window, resulting in a transition breakdown when the patient was not home for the scheduled start-of-care.",,,,,,Pre-DC_Call_Disconnect: Attempted 24-hour pulse call to daughter (POA) three times; all calls went to voicemail. Home readiness and first-visit window remain unconfirmed.,,,,,V-Card successfully inserted into patient's smartphone and physical program flyer delivered to the bedside during the Week 2 education session.,v5,Week 2: SW reports wound is showing granulation; PT notes patient is now 'Min Assist' for transfers. Target discharge date set for Wednesday the 15th.
synthetic_cases,,True,Entered Discharge Date (11/14) and 1st Visit Date (11/15) into the Atlantis transition module.,,synthetic_batch_25_v5,,,,Success_Home_with_First_Visit,,,2026-03-05T21:57:34.15135+00:00,Audited Atlantis demographics against SNF face sheet; found that the patient's primary phone was listed as the facility's main line. Corrected it to her personal cell and verified Aetna Medicare Advantage is active and in-network for preferred HHA providers.,,,,"[{""edd_delta"": ""+2\u20137 Days"", ""clinical_impact"": ""Unchanged"", ""event_description"": ""Caregiver_Panic: Daughter expresses fear of managing post-chemo side effects alone."", ""environmental_impact"": ""Worsens"", ""ai_assumed_bottleneck"": ""Family/Caregiver"", ""service_adoption_impact"": ""Positive""}, {""edd_delta"": ""+1\u20133 Days"", ""clinical_impact"": ""Unchanged"", ""event_description"": ""Atlantis_Data_Lag: POA phone number transposed in the system queue."", ""environmental_impact"": ""Unchanged"", ""ai_assumed_bottleneck"": ""Administrative"", ""service_adoption_impact"": ""Negative""}]","[{""situation"": ""Daughter threatens to refuse discharge due to fear of patient falling."", ""action_taken"": ""Walked daughter through Day 1 expectations and the role of the MA visit."", ""intent_detail"": ""Educating on program expectations"", ""intent_category"": ""Educate""}, {""situation"": ""SW needs to know if the patient's home is ready for the transition."", ""action_taken"": ""Conducted 24-hour pre-discharge pulse call to verify home readiness."", ""intent_detail"": ""Verifying logistics and data accuracy"", ""intent_category"": ""Verify""}, {""situation"": ""Daughter requests medical advice on managing patient's chemo-induced nausea."", ""action_taken"": ""Escalated clinical concerns to the Social Worker and floor nurse."", ""intent_detail"": ""Escalating to SW for resolution"", ""intent_category"": ""Escalate""}]","[{""rationale"": ""Respects the SW boundary regarding discharge timing and family counseling (Stage 2: Maintenance)."", ""description"": ""Step back and allow the Social Worker to manage the daughter's anxiety and the potential discharge delay without PN interference."", ""ai_intended_category"": ""Passive""}, {""rationale"": ""Follows the Scheduling Anchor and Patient Education protocols (Stage 3: Handoff)."", ""description"": ""Provide a physical appointment card to the daughter and confirm the 24-hour MA visit schedule to provide a concrete safety net."", ""ai_intended_category"": ""Proactive""}, {""rationale"": ""Violates the Banned Actions list by suggesting specific agencies and handling insurance/clinical-related paperwork."", ""description"": ""Advise the daughter on which HHA agency has the best oncology nurses and help her fill out the insurance authorization forms to speed up the process."", ""ai_intended_category"": ""Overstep""}]",,"Social Worker (SW) confirmed the goal is Home with HHA and PT support, as the patient has a strong desire to return to her apartment despite post-chemo fatigue.",37b7a7f3-d6c9-4eae-8fad-58a137d1108c,,Case_13,"Medical Assistant (MA) successfully scheduled for the first home visit on 11/15 at 10:00 AM, strictly within the 24-hour post-discharge window.","Initiated Triage for a 74yo post-chemo patient, correcting critical contact data in Atlantis during the initial audit. Managed significant 'Caregiver_Panic' during the Maintenance stage by providing the daughter with concrete expectations and a physical appointment card. Secured a successful transition home by scheduling a 24-hour MA follow-up, overcoming family-driven friction to trigger the first visit incentive.",,,,,,"Conducted 24-hour pulse call. Reached the daughter who was in a state of 'Caregiver_Panic', threatening to refuse the discharge transport. De-escalated by confirming the MA visit window and reviewing the physical appointment card details.",,,,,V-Card inserted into patient's iPhone contacts; physical program flyer delivered to daughter during the weekly care conference to reinforce the 24-hour support model.,v5,"Week 2: Patient is meeting PT goals for stair navigation, but the daughter (POA) is expressing extreme anxiety about managing the patient's nausea and weakness at home, calling the SW to request a 7-day discharge delay."
synthetic_cases,,True,"Discharge date entered as Friday, 10/27. First visit (MA) scheduled for Saturday, 10/28. Logged in Atlantis queue.",,synthetic_batch_25_v5,,,,Success_Home_with_First_Visit,,,2026-03-05T21:57:34.15135+00:00,Verified Medicare Advantage eligibility; found address mismatch between Atlantis and facility face sheet (Zip code 19104 vs 19143). Corrected primary phone to daughter's mobile for POA access.,,,,"[{""edd_delta"": ""+3 Days"", ""clinical_impact"": ""Unchanged"", ""event_description"": ""HHA_Intake_Freeze: System outage at regional agency prevents new admission processing."", ""environmental_impact"": ""Worsens"", ""ai_assumed_bottleneck"": ""Operational"", ""service_adoption_impact"": ""Negative""}, {""edd_delta"": ""+2 Days"", ""clinical_impact"": ""Worsens"", ""event_description"": ""Friday Discharge Gap: Facility proceeds with discharge despite HHA inability to staff a weekend RN."", ""environmental_impact"": ""Unchanged"", ""ai_assumed_bottleneck"": ""Operational"", ""service_adoption_impact"": ""Negative""}, {""edd_delta"": ""0 Days"", ""clinical_impact"": ""Improves"", ""event_description"": ""MA Scheduling Bridge: PN secures Saturday morning slot for Medical Assistant assessment."", ""environmental_impact"": ""Unchanged"", ""ai_assumed_bottleneck"": ""Operational"", ""service_adoption_impact"": ""Positive""}]","[{""situation"": ""HHA intake coordinator reports a freeze on new referrals due to a system-wide outage."", ""action_taken"": ""Flagged the intake delay to the Social Worker and requested a status update on the referral's internal 'Hub' receipt."", ""intent_detail"": ""Escalating to SW for resolution"", ""intent_category"": ""Escalate""}, {""situation"": ""Patient's daughter expresses fear about managing MS symptoms over the weekend without a nurse."", ""action_taken"": ""Educated the daughter on the MA's role in verifying home safety and medication setup while the HHA nurse visit is pending."", ""intent_detail"": ""Educating on program expectations"", ""intent_category"": ""Educate""}, {""situation"": ""Atlantis demographics list an outdated landline for the patient."", ""action_taken"": ""Audited the facility face sheet and updated Atlantis with the correct POA mobile number to ensure pulse call success."", ""intent_detail"": ""Verifying logistics and data accuracy"", ""intent_category"": ""Verify""}]","[{""rationale"": ""Respects the SW's boundary as the sole party responsible for agency selection and referral management."", ""description"": ""Wait for the Social Worker to identify an alternative HHA that is not currently under an intake freeze."", ""ai_intended_category"": ""Passive""}, {""rationale"": ""Follows the Stage 3 checklist to ensure a 24-hour visit occurs, maintaining the transition incentive within scope."", ""description"": ""Schedule the Medical Assistant for a Saturday morning visit and hand the daughter a physical appointment card to bridge the HHA's weekend staffing gap."", ""ai_intended_category"": ""Proactive""}, {""rationale"": ""Violates the SW boundary by interfering with HHA operations and the 'Banned Actions' regarding F2F forms."", ""description"": ""Call the HHA's intake director directly to advocate for the patient's referral and offer to help complete the Face-to-Face (F2F) paperwork."", ""ai_intended_category"": ""Overstep""}]",,Social Worker confirms the goal is Home with HHA services for PT and nursing oversight following MS steroid taper.,3980c994-7d56-4304-b8f4-c52c753c076f,,Case_14,MA scheduled for Saturday at 11:00 AM to ensure the 24-hour post-discharge window is met despite the HHA intake backlog.,"The patient, a 68yo female recovering from an MS flare, was tracked from intake through a complex Friday discharge. During Stage 2, I identified a regional HHA Intake Freeze that threatened the 'First Visit' window, necessitating intensive family education on the transition timeline. In Stage 3, I successfully bypassed the HHA's operational delay by scheduling our Medical Assistant for a Saturday morning visit, securing the transition incentive and ensuring the patient was not left unmonitored over the weekend.",,,,,,"Reached POA 24 hours prior to discharge. Confirmed hospital bed and O2 are in place. Alerted family that the HHA nurse visit is delayed due to the intake freeze, but our MA visit remains scheduled.",,,,,V-Card successfully saved to patient's smartphone during bedside education session; physical program flyer delivered to daughter/POA.,v5,"Week 2: Patient completed IV steroids. SW reports gait is stabilizing. Target discharge set for Friday; however, HHA reported a temporary intake department freeze due to a regional system outage."
synthetic_cases,,True,D/C Date: 08/30 (Friday); 1st Visit Date: 09/03 (Tuesday). Gap identified in Atlantis due to HHA staffing constraints over Labor Day.,,synthetic_batch_25_v5,,,,Failure_Transition_Breakdown,,,2026-03-05T21:57:34.15135+00:00,"Verified Medicare Advantage eligibility; identified that the Atlantis record listed the patient's former residence in a 2nd-floor walk-up, but the facility face sheet confirms she is moving to her daughter's ADA-compliant ground-floor ranch. Updated address and primary POA phone in Atlantis.",,,,"[{""edd_delta"": ""+2\u20135 Days"", ""clinical_impact"": ""Worsens"", ""event_description"": ""Holiday Coverage Gap: HHA reports reduced staffing for Labor Day weekend; no new admissions processed from Friday 5 PM until Tuesday 8 AM."", ""environmental_impact"": ""Unchanged"", ""ai_assumed_bottleneck"": ""Operational"", ""service_adoption_impact"": ""Negative""}, {""edd_delta"": ""+1\u20133 Days"", ""clinical_impact"": ""Unchanged"", ""event_description"": ""HHA_SOC_Overlap: HHA's skeleton crew for the weekend is fully booked with existing patients, preventing the 24-hour post-discharge visit for new referrals."", ""environmental_impact"": ""Unchanged"", ""ai_assumed_bottleneck"": ""Operational"", ""service_adoption_impact"": ""Negative""}]","[{""situation"": ""HHA intake coordinator informs PN that the first visit cannot occur until Tuesday due to the holiday."", ""action_taken"": ""Escalated the holiday coverage gap to the Social Worker to flag the risk of a 72-hour monitoring void for a CHF patient."", ""intent_detail"": ""Escalating to SW for resolution"", ""intent_category"": ""Escalate""}, {""situation"": ""Daughter expresses fear that her mother will 'backslide' without a nurse over the long weekend."", ""action_taken"": ""Walked the family through Stage 3 Day 1 expectations, explaining the difference between the HHA nurse visit and the PN's MA scheduling."", ""intent_detail"": ""Educating on program expectations"", ""intent_category"": ""Educate""}, {""situation"": ""Atlantis demographics list an outdated landline for the patient."", ""action_taken"": ""Audited the face sheet and updated the contact number to the daughter\u2019s mobile to ensure the HHA can reach them."", ""intent_detail"": ""Verifying logistics and data accuracy"", ""intent_category"": ""Verify""}]","[{""rationale"": ""This follows the 'Strategic Deferral' model, respecting the SW boundary by not attempting to manipulate the discharge date or agency capacity directly."", ""description"": ""The PN documents the HHA's holiday staffing delay in Atlantis and informs the SW that the first visit will be Tuesday, then steps back to allow the facility and agency to manage the clinical handoff."", ""ai_intended_category"": ""Passive""}, {""rationale"": ""This is checklist-compliant; the PN identifies a barrier (Stage 3 handoff failure) and escalates it to the appropriate professional (SW) for clinical safety determination."", ""description"": ""The PN flags the Friday discharge to the SW, highlighting that the HHA cannot perform the 24-hour pulse call or first visit until Tuesday, and asks the SW to verify if the patient is safe for a 3-day gap without RN monitoring."", ""ai_intended_category"": ""Proactive""}, {""rationale"": ""This is an automatic overstep; the PN is suggesting specific alternative HHAs and interfering with the SW's referral management role."", ""description"": ""The PN calls two other local home health agencies to find one that has a nurse working on Saturday, then presents these options to the daughter and tells her to ask the SW to switch agencies to ensure a faster visit."", ""ai_intended_category"": ""Overstep""}]",,Social Worker confirmed the goal is Home with HHA for CHF management and PT; patient has strong family support and LTC is not being pursued.,f30f8c42-b2ec-4939-a060-ad5614ebc23b,,Case_15,"MA visit attempted for Saturday (08/31) but blocked; HHA policy prevents MA entry until the RN has completed the initial Start-of-Care (SOC) assessment, which is delayed until Tuesday.","Mrs. Thorne's transition was successfully audited in Stage 1, correcting a critical address error that would have sent the MA to the wrong location. During Stage 2, the family was educated on CHF monitoring and the importance of the 24-hour visit window. However, the Friday discharge coincided with a Labor Day holiday coverage gap, where the HHA intake department froze new admissions. This operational barrier pushed the first visit to the following Tuesday, resulting in a transition breakdown regarding the incentive window.",,,,,,"Reached daughter 24 hours prior to Friday discharge. Confirmed home is ready, but daughter is anxious as the HHA intake coordinator hinted that the 'Start of Care' might be delayed due to the holiday weekend.",,,,,V-Card inserted into daughter's phone; physical program flyer delivered to patient and reviewed at bedside during Stage 2 check-in.,v5,Week 2: PT notes patient is now 'Supervised' for transfers; SW targets discharge for the Friday before Labor Day. Edema is stable with current diuretic regimen.
