source_table,ai_intended_category,atlantis_entry_confirmed,atlantis_final_sync,authenticity_reasoning,batch_id,bottleneck_realism,case_id,case_label,case_outcome,clinical_impact,completed_at,created_at,demographic_audit_note,edd_delta,environmental_impact,event_index,format_1_state_log,format_2_triples,format_3_rl_scenario,home_service_adoption_impact,home_vs_ltc_goal,id,improvement_suggestion,label,narrative_summary,navigator_id,navigator_name,option_index,overall_field_authenticity,pn_category,pre_dc_pulse_call,role_delineation_check,session_id,status,tactical_viability_score,triple_index,v_card_flyer_status,version
synthetic_cases,,True,"Once the Social Worker verbally confirmed that the home health agency had finally accepted the referral and set a start-of-care date, the Navigator recorded the confirmed discharge date and scheduled the Medical Assistant's first home visit within the 24-hour window in Atlantis.",,synthetic_batch_25_v13,,,,Success_Home_with_First_Visit,,,2026-03-25T12:40:36.824045+00:00,The Navigator audited the facility face sheet against the Atlantis record and discovered that Arthur's primary contact number was missing a digit; the entry was corrected in Atlantis to ensure the home team could reach the family for the 24-hour pulse call.,,,,"[{""edd_delta"": ""0 Days"", ""clinical_impact"": ""Unchanged"", ""event_description"": ""The Navigator introduced the Healing Partners program to Arthur and his daughter, confirming their preference for home discharge and verifying their contact details for the Atlantis record."", ""environmental_impact"": ""Improves"", ""ai_assumed_bottleneck"": ""None"", ""service_adoption_impact"": ""Positive""}, {""edd_delta"": ""+5 Days"", ""clinical_impact"": ""Worsens"", ""event_description"": ""The Social Worker notified the Navigator that the home health agency had placed a freeze on all new intake due to a staffing crisis, preventing the referral from being processed."", ""environmental_impact"": ""Worsens"", ""ai_assumed_bottleneck"": ""HHA_Intake_Freeze"", ""service_adoption_impact"": ""Negative""}, {""edd_delta"": ""0 Days"", ""clinical_impact"": ""Unchanged"", ""event_description"": ""During a weekly update, the Navigator noted the ongoing intake delay in Atlantis and focused on educating the family on the 24-hour post-discharge window to maintain engagement while the Social Worker sought an alternative solution."", ""environmental_impact"": ""Unchanged"", ""ai_assumed_bottleneck"": ""HHA_Intake_Freeze"", ""service_adoption_impact"": ""Positive""}, {""edd_delta"": ""0 Days"", ""clinical_impact"": ""Improves"", ""event_description"": ""The Social Worker confirmed that the agency freeze was lifted and Arthur was officially accepted for home care; the Navigator documented the update and prepared the final transition logistics."", ""environmental_impact"": ""Improves"", ""ai_assumed_bottleneck"": ""None"", ""service_adoption_impact"": ""Positive""}]","[{""situation"": ""The family is confused about which provider will be visiting the home first after Arthur leaves the facility."", ""action_taken"": ""The Navigator walked the family through the Day 1 expectations, specifically defining the role of the Medical Assistant and the 24-hour window for the first visit."", ""intent_category"": ""Educate""}, {""situation"": ""The Social Worker reports a complete halt in agency admissions that is not visible in any shared system."", ""action_taken"": ""The Navigator documented the administrative gap in Atlantis and alerted the Social Worker that they would wait for a verbal confirmation of agency acceptance before proceeding with scheduling."", ""intent_category"": ""Flag""}, {""situation"": ""Arthur's daughter expresses fear that she will not know how to operate the portable oxygen concentrator at home."", ""action_taken"": ""The Navigator noted the caregiver's anxiety in Atlantis and directed her to request a formal training session from the facility's clinical team and the Social Worker."", ""intent_category"": ""Flag""}]","[{""rationale"": ""This respects the boundary that the Social Worker owns the vendor relationship and prevents the Navigator from interfering in the referral process."", ""description"": ""The Navigator notes that the Social Worker has not provided an update on the agency freeze for 48 hours and chooses to document the communication gap in Atlantis while waiting for the facility team to resolve the referral status."", ""ai_intended_category"": ""Passive""}, {""rationale"": ""The Navigator remains within their lane by seeking information from the proper channel and focusing on family education and data verification."", ""description"": ""The Navigator asks the Social Worker for a verbal status update regarding the agency freeze and then meets with Arthur to confirm the V-Card is active on his phone and to review the Healing Partners program flyer."", ""ai_intended_category"": ""Proactive""}, {""rationale"": ""This is an overstep because the Navigator is contacting a vendor directly and providing clinical education, both of which are strictly outside their professional scope."", ""description"": ""The Navigator calls the home health agency's intake department to ask when the freeze will be lifted and then attempts to explain the correct settings for Arthur's oxygen flow to his daughter to ease her mind."", ""ai_intended_category"": ""Overstep""}]",,Home with Home Health Services,554083e7-2074-4f75-b683-7c3ad169f0ae,,Case_9,"Arthur Vance, a 65-year-old recovering from a severe COPD exacerbation, faced a significant discharge delay when the selected home health agency announced a temporary freeze on all new admissions due to an internal staffing shortage. This administrative bottleneck caused visible distress for Arthur, who was eager to return home but worried about managing his breathing treatments without professional support. The Navigator acted as a vital liaison by documenting the intake delay in Atlantis and providing the family with clear education on the Medical Assistant's first-day role, ensuring they felt prepared for the transition once the Social Worker cleared the logistical hurdle.",,,,,,"The Navigator reached Arthur's daughter 24 hours before the rescheduled discharge; while she expressed relief that the agency freeze had lifted, she remained anxious about oxygen tank safety, so the Navigator documented this sentiment in Atlantis and encouraged her to speak with the Social Worker before leaving the facility.","The Social Worker is responsible for managing the home health agency referral and resolving the intake department freeze, while the Navigator focuses on verifying Arthur's demographic data in Atlantis, educating the family on the Healing Partners program, and flagging transition barriers for the clinical team.",,,,,"The Navigator met with Arthur and his daughter at the bedside to install the Healing Partners V-Card into their phones, explaining that this would allow them to recognize our team's caller ID and differentiate our support calls from other facility vendors.",v13
synthetic_cases,,True,"After the Social Worker verbally confirmed that a backup nurse was assigned for Tuesday, I recorded the final discharge date in Atlantis and scheduled the Medical Assistant’s initial home visit for the following morning.",,synthetic_batch_25_v13,,,,Success_Home_with_First_Visit,,,2026-03-25T12:40:36.824045+00:00,I cross-referenced the facility face sheet with the Atlantis record and found that the patient's secondary contact number was missing; I updated the profile in Atlantis with her daughter’s mobile number to ensure the Medical Assistant could reach them for the first home visit.,,,,"[{""edd_delta"": ""+3\u20135 Days"", ""clinical_impact"": ""Unchanged"", ""event_description"": ""The Social Worker informed me that the intake coordinator at the preferred home health agency is out sick, which has paused the processing of Elena's referral; I documented this operational delay in the Atlantis timeline."", ""environmental_impact"": ""Worsens"", ""ai_assumed_bottleneck"": ""Provider Illness"", ""service_adoption_impact"": ""Negative""}, {""edd_delta"": ""0 Days"", ""clinical_impact"": ""Unchanged"", ""event_description"": ""During a follow-up conversation, the Social Worker confirmed they are reaching out to a secondary agency to see if they can staff the case sooner; I updated the wait-status log in Atlantis to reflect this shift in the plan."", ""environmental_impact"": ""Improves"", ""ai_assumed_bottleneck"": ""None"", ""service_adoption_impact"": ""Positive""}, {""edd_delta"": ""0 Days"", ""clinical_impact"": ""Unchanged"", ""event_description"": ""The daughter shared her concerns about the delay during my afternoon round; I explained that the Social Worker is currently resolving the staffing issue and documented her anxiety regarding the transition timeline in Atlantis."", ""environmental_impact"": ""Unchanged"", ""ai_assumed_bottleneck"": ""Sentiment Readiness Gap"", ""service_adoption_impact"": ""Negative""}]","[{""situation"": ""The Social Worker has not yet confirmed if the secondary agency has accepted the referral."", ""action_taken"": ""Noted the ongoing communication gap in the Atlantis timeline and scheduled a follow-up with the Social Worker for the next morning."", ""intent_category"": ""Flag""}, {""situation"": ""The daughter asked for specific details on how to manage Elena's new Multiple Sclerosis medications at home."", ""action_taken"": ""Directed the daughter to speak directly with the facility nursing staff and the Social Worker for all clinical education and medication schedules."", ""intent_category"": ""Educate""}, {""situation"": ""The patient's home address in Atlantis was missing the apartment number found on the facility face sheet."", ""action_taken"": ""Corrected the demographic details in Atlantis to ensure the Medical Assistant has the accurate location for the first home visit."", ""intent_category"": ""Verify""}]","[{""rationale"": ""This respects the Social Worker's ownership of the referral process and follows the mandatory wait default when information has not been verbally shared."", ""description"": ""The Social Worker has not provided an update on the new agency's acceptance, so the Navigator notes the lack of information in Atlantis and waits for the next scheduled facility huddle to request a status update."", ""ai_intended_category"": ""Passive""}, {""rationale"": ""This action stays within the Navigator's lane by seeking information from the correct internal source and providing program-specific education to the family."", ""description"": ""The Navigator asks the Social Worker for a verbal status update on the backup agency and then uses the opportunity to educate the family on the 24-hour post-discharge window for the Medical Assistant's visit."", ""ai_intended_category"": ""Proactive""}, {""rationale"": ""This violates the no-vendor rule by contacting the agency directly and crosses into clinical education, which is reserved for the facility staff and the Social Worker."", ""description"": ""To prevent further delays, the Navigator calls the home health agency's intake office directly to confirm if they have received the referral and then instructs the family on how to perform basic mobility assistance for Multiple Sclerosis patients."", ""ai_intended_category"": ""Overstep""}]",,Home with Home Health Agency services,c8545418-0d03-47d1-ac9a-089d11ac357d,,Case_10,"Elena Vance, a 68-year-old recovering from a significant Multiple Sclerosis flare, was prepared to return home until a sudden illness sidelined the primary home health intake coordinator. This administrative gap threatened to stall her discharge and leave her without immediate support for her mobility needs. The Navigator acted as a supportive liaison by documenting the communication delay in Atlantis and maintaining close contact with Elena’s daughter to ensure the family remained informed while the Social Worker arranged for a substitute provider to cover the case.",,,,,,"I spoke with the family 24 hours before the scheduled discharge; while they expressed some anxiety about the recent staffing change at the home health agency, they confirmed they are ready for the transition and understand the timing for our first visit.","The Social Worker manages the home health agency referral and clinical discharge timeline, while the Navigator audits demographic data in Atlantis, explains the Healing Partners program to the family, and flags the delay caused by the provider's absence to the Social Worker to ensure a backup plan is in place.",,,,,"During a bedside visit, I helped Elena’s daughter save the Healing Partners digital contact card into her phone and provided the program flyer, explaining that this would help them recognize our team's calls during the critical 24-hour window following discharge.",v13
synthetic_cases,,True,"I updated Atlantis with the confirmed Friday discharge date and scheduled the medical assistant's first home visit for Saturday morning, ensuring the twenty-four-hour window was met after the Social Worker confirmed the agency acceptance.",,synthetic_batch_25_v13,,,,Success_Home_with_First_Visit,,,2026-03-25T12:40:36.824045+00:00,I performed a thorough audit of the Atlantis record against the facility face sheet and found that the patient's secondary contact number for her son was incorrect; I updated the record in Atlantis to ensure both children could be reached during the transition process.,,,,"[{""edd_delta"": ""+2\u20137 Days"", ""clinical_impact"": ""Unchanged"", ""event_description"": ""The Social Worker informed me that Martha's son and daughter are at an impasse regarding her discharge destination; I documented this family conflict in Atlantis and noted that no discharge date can be set until they reach an agreement."", ""environmental_impact"": ""Worsens"", ""ai_assumed_bottleneck"": ""Family Disagreement on Discharge Plan"", ""service_adoption_impact"": ""Negative""}, {""edd_delta"": ""+1\u20134 Days"", ""clinical_impact"": ""Unchanged"", ""event_description"": ""The daughter shared during a bedside visit that she is overwhelmed by her brother's pressure to move Martha to a nursing home; I listened to her concerns and documented her distress in Atlantis while suggesting she speak directly with the Social Worker about her brother's stance."", ""environmental_impact"": ""Unchanged"", ""ai_assumed_bottleneck"": ""Sentiment_Readiness_Gap"", ""service_adoption_impact"": ""Negative""}, {""edd_delta"": ""+2\u20135 Days"", ""clinical_impact"": ""Improves"", ""event_description"": ""The Social Worker called to confirm that the family agreed to a home trial with intensive nursing support, but the chosen agency has not yet confirmed a nurse is available for the weekend; I documented this update and began the waiting period for agency confirmation."", ""environmental_impact"": ""Improves"", ""ai_assumed_bottleneck"": ""HHA_Acceptance_Stall"", ""service_adoption_impact"": ""Positive""}, {""edd_delta"": ""0 Days"", ""clinical_impact"": ""Improves"", ""event_description"": ""After the Social Worker verbally confirmed that the agency had officially accepted the case for a Friday discharge, I entered the final dates in Atlantis and coordinated the medical assistant's arrival for the following morning."", ""environmental_impact"": ""Improves"", ""ai_assumed_bottleneck"": ""None"", ""service_adoption_impact"": ""Positive""}]","[{""situation"": ""The son expressed fear that his mother would fall during the first night home because the nurse might not arrive until Monday."", ""action_taken"": ""I explained that our medical assistant visit is specifically designed to occur within the first twenty-four hours of discharge to bridge that gap and documented his concern in Atlantis."", ""intent_category"": ""Educate""}, {""situation"": ""The daughter asked if the home health nurse would be able to adjust her mother's multiple sclerosis medications."", ""action_taken"": ""I advised the daughter that all clinical questions regarding medication management must be discussed with the Social Worker and the home health agency clinical team."", ""intent_category"": ""Flag""}, {""situation"": ""The Social Worker was in a meeting and could not provide an update on whether the home health agency had accepted the referral."", ""action_taken"": ""I documented the current lack of information in the Atlantis log and waited for the Social Worker to return my call rather than contacting the agency myself."", ""intent_category"": ""Verify""}]","[{""rationale"": ""This respects the Social Worker's ownership of the discharge plan and family mediation while maintaining a clear record of the waiting period in the Navigator's personal documentation."", ""description"": ""The Navigator notes that the Social Worker has not yet provided an update on the family's decision regarding home vs. facility care. The Navigator documents in Atlantis that they are waiting for the Social Worker's direction before proceeding with any family education or scheduling."", ""ai_intended_category"": ""Passive""}, {""rationale"": ""This action remains within the Navigator's scope by focusing on family education and direct communication with the Social Worker without interfering in clinical or vendor logistics."", ""description"": ""The Navigator asks the Social Worker for a verbal update on the status of the home health referral. Once a tentative plan is mentioned, the Navigator meets with the daughter to demonstrate how to use the V-Card and explains what the medical assistant will do on the first day to provide support."", ""ai_intended_category"": ""Proactive""}, {""rationale"": ""This is an overstep because the Navigator is prohibited from contacting agencies directly and should never make clinical promises or set expectations for the home health nurse's schedule."", ""description"": ""The Navigator calls the home health agency's intake department to advocate for Martha's case, explaining that a quick acceptance might help convince the skeptical son that home care is the right choice. The Navigator then promises the family that the nurse will arrive before noon on the day of discharge."", ""ai_intended_category"": ""Overstep""}]",,Home with Home Health Agency,87912d27-fd20-4719-bf1b-ba39b832c04b,,Case_11,"Martha Vance, a 68-year-old struggling with a severe multiple sclerosis flare, faced a difficult transition as her children disagreed on her ability to return home safely. While her daughter felt home care was sufficient, her son insisted on a long-term care placement, creating a significant delay in the planning process. The Navigator acted as a neutral liaison by documenting these conflicting viewpoints in Atlantis and educating the family on how the Healing Partners program provides an extra layer of support during the first twenty-four hours at home. Once the Social Worker resolved the family dispute in favor of a home discharge, the Navigator ensured all demographics were accurate and the family was prepared for the initial medical assistant visit.",,,,,,"I reached the daughter twenty-four hours before discharge; she confirmed that the home was ready and that she had the transition flyer, though she noted her brother was still nervous about the first night alone. I documented this sentiment in Atlantis and confirmed the daughter would be present for the first visit.","The Social Worker is responsible for mediating the conflict between the patient's children regarding the discharge destination and coordinating the final agency selection, while the Navigator verifies the patient's contact data in Atlantis, explains the role of the Medical Assistant to the family, and documents the family's specific anxieties for the clinical team's awareness.",,,,,I helped Martha and her daughter save the Healing Partners digital contact card into their phones to ensure they would recognize our calls after discharge. I also provided a physical flyer detailing the medical assistant's role to help alleviate the son's concerns about the lack of support at home.,v13
