source_table,ai_intended_category,atlantis_entry_confirmed,atlantis_final_sync,authenticity_reasoning,batch_id,bottleneck_realism,case_id,case_label,case_outcome,clinical_impact,completed_at,created_at,demographic_audit_note,edd_delta,environmental_impact,event_index,format_1_state_log,format_2_triples,format_3_rl_scenario,home_service_adoption_impact,home_vs_ltc_goal,id,improvement_suggestion,label,narrative_summary,navigator_id,navigator_name,option_index,overall_field_authenticity,pn_category,pre_dc_pulse_call,role_delineation_check,session_id,status,tactical_viability_score,triple_index,v_card_flyer_status,version
synthetic_cases,,True,The Navigator recorded the confirmed discharge date in Atlantis and scheduled the Medical Assistant's first home visit for the morning following Martha's return home.,,synthetic_batch_25_v13,,,,Success_Home_with_First_Visit,,,2026-03-25T12:40:36.824045+00:00,The Navigator audited the facility face sheet against the Atlantis record and identified an error in the primary phone number; the corrected contact information for Martha's husband was entered into Atlantis to ensure seamless communication post-discharge.,,,,"[{""edd_delta"": ""+2\u20135 Days"", ""clinical_impact"": ""Unchanged"", ""event_description"": ""The Navigator met with Martha's husband, who shared that he had not yet been shown how to assist with her transfers; the Navigator documented this training gap in Atlantis and informed him that the Social Worker would be the best person to coordinate that teaching."", ""environmental_impact"": ""Worsens"", ""ai_assumed_bottleneck"": ""Caregiver Training Gap"", ""service_adoption_impact"": ""Negative""}, {""edd_delta"": ""+2\u20135 Days"", ""clinical_impact"": ""Unchanged"", ""event_description"": ""After noticing no updates in the transition plan, the Navigator asked the Social Worker for a verbal status update; the Social Worker noted that the home health agency had been selected but the start-of-care date was pending the completion of family training."", ""environmental_impact"": ""Unchanged"", ""ai_assumed_bottleneck"": ""HHA_Acceptance_Stall"", ""service_adoption_impact"": ""Unchanged""}, {""edd_delta"": ""0"", ""clinical_impact"": ""Improves"", ""event_description"": ""The Social Worker confirmed that the family training was completed and the home health agency accepted the referral for a Monday discharge; the Navigator updated the timeline in Atlantis and began preparing the family for the transition."", ""environmental_impact"": ""Improves"", ""ai_assumed_bottleneck"": ""None"", ""service_adoption_impact"": ""Positive""}]","[{""situation"": ""The husband expressed deep concern about his ability to manage Martha's clinical needs."", ""action_taken"": ""The Navigator documented the caregiver's sentiment in Atlantis and alerted the Social Worker to the family's request for bedside training."", ""intent_category"": ""Flag""}, {""situation"": ""The family was unclear about how the Healing Partners program would support them once they left the facility."", ""action_taken"": ""The Navigator explained the role of the Medical Assistant and the importance of the 24-hour post-discharge visit window."", ""intent_category"": ""Educate""}, {""situation"": ""The Navigator required a status update on the home health agency acceptance to coordinate the next steps."", ""action_taken"": ""The Navigator asked the Social Worker directly for a verbal update on the referral status and documented the response in Atlantis."", ""intent_category"": ""Verify""}]","[{""rationale"": ""This respects the Social Worker's ownership of the referral process and avoids unauthorized contact with outside agencies."", ""description"": ""The Navigator notes that the Social Worker has not yet provided an update on the home health agency's acceptance of the case and chooses to document this communication gap in Atlantis while waiting for a response."", ""ai_intended_category"": ""Passive""}, {""rationale"": ""This action stays within the Navigator's lane by gathering information from the appropriate internal source and focusing on family education and program recognition."", ""description"": ""The Navigator asks the Social Worker for a verbal status update on the home health referral and simultaneously confirms with the family that they have saved the Healing Partners contact information in their phones."", ""ai_intended_category"": ""Proactive""}, {""rationale"": ""This is an overstep because it involves direct contact with a vendor and attempts to influence clinical training, which is the sole responsibility of the facility and the home health agency."", ""description"": ""The Navigator calls the home health agency intake department to ask if they have a nurse available who can also provide a quick tutorial on multiple sclerosis flare management for the husband."", ""ai_intended_category"": ""Overstep""}]",,Home with Home Health Agency support.,4c1425a4-3efd-49ee-ad3e-9e83689034c3,,Case_1,"Martha Vance, a 68-year-old woman recovering from a significant multiple sclerosis flare, faced a major transition hurdle when her husband expressed intense anxiety about his lack of training for her new mobility needs. While Martha met her clinical milestones for discharge, her husband's fear of managing her care at home threatened to stall the process. The Navigator acted as a crucial liaison by documenting this caregiver training gap in Atlantis and alerting the Social Worker to the family's need for a bedside demonstration. This ensured that the clinical team addressed the husband's concerns, allowing for a confident move back home with the support of the Healing Partners program.",,,,,,"During the 24-hour pre-discharge call, Martha's husband confirmed that the Social Worker had completed the bedside training and they felt ready for the transition, though he requested a reminder of the Medical Assistant's visit window.","The Social Worker is responsible for coordinating the home health referral and ensuring the family receives clinical training on catheter care, while the Navigator focuses on auditing demographic data in Atlantis, educating the family on the Healing Partners program, and alerting the Social Worker to caregiver anxiety regarding the transition.",,,,,"The Navigator provided the program flyer to Martha's husband and successfully saved the Healing Partners V-Card into his smartphone contacts, explaining that this would help him recognize the caller ID for the first-day follow-up call.",v13
synthetic_cases,,True,I documented the confirmed Friday discharge date in Atlantis and scheduled the Medical Assistant's first home visit for Saturday morning to ensure the twenty-four-hour window was met.,,synthetic_batch_25_v13,,,,Success_Home_with_First_Visit,,,2026-03-25T12:40:36.824045+00:00,I compared the facility face sheet against the Atlantis record and discovered that the primary contact number was listed as Arthur's disconnected landline; I updated the record with his daughter's mobile number and verified the home address for the Medical Assistant's travel route.,,,,"[{""edd_delta"": ""+2\u20137 Days"", ""clinical_impact"": ""Unchanged"", ""event_description"": ""The Navigator met with Arthur and his daughter at the bedside; Martha expressed significant distress and panic regarding Arthur's post-stroke weakness, which the Navigator documented in Atlantis for the Social Worker's awareness."", ""environmental_impact"": ""Worsens"", ""ai_assumed_bottleneck"": ""Caregiver Panic"", ""service_adoption_impact"": ""Negative""}, {""edd_delta"": ""+2\u20135 Days"", ""clinical_impact"": ""Unchanged"", ""event_description"": ""The Social Worker informed the Navigator that the family requested a delay in discharge due to their anxiety; the Navigator noted this timeline shift in Atlantis and waited for the clinical team to address the family's training concerns."", ""environmental_impact"": ""Unchanged"", ""ai_assumed_bottleneck"": ""Caregiver Training Gap"", ""service_adoption_impact"": ""Negative""}, {""edd_delta"": ""None"", ""clinical_impact"": ""Improves"", ""event_description"": ""Following a care conference, the Social Worker confirmed that the daughter felt comfortable moving forward with a Friday discharge; the Navigator updated the transition plan in Atlantis and began final education on the first-day Medical Assistant visit."", ""environmental_impact"": ""Improves"", ""ai_assumed_bottleneck"": ""None"", ""service_adoption_impact"": ""Positive""}]","[{""situation"": ""The daughter expressed intense fear about Arthur falling during transfers at home."", ""action_taken"": ""The Navigator documented the sentiment in Atlantis and alerted the Social Worker to the family's lack of confidence."", ""intent_category"": ""Flag""}, {""situation"": ""The daughter asked for details regarding the Healing Partners service and who would be visiting the home."", ""action_taken"": ""The Navigator explained the role of the Medical Assistant and the purpose of the twenty-four-hour post-discharge check-in."", ""intent_category"": ""Educate""}, {""situation"": ""The facility face sheet listed an incorrect apartment number for the patient's residence."", ""action_taken"": ""The Navigator corrected the address in Atlantis to ensure the home team has the accurate location for the first visit."", ""intent_category"": ""Verify""}]","[{""rationale"": ""This respects the Social Worker's ownership of the referral process and prevents the Navigator from attempting to source information from unauthorized clinical systems."", ""description"": ""The Navigator notes that the Social Worker has not yet provided the name of the assigned home health agency and chooses to document this information gap in Atlantis while waiting for a verbal update from the facility staff."", ""ai_intended_category"": ""Passive""}, {""rationale"": ""This remains within the Navigator's lane by facilitating communication with the Social Worker and providing program education to the family without interfering in vendor selection."", ""description"": ""The Navigator asks the Social Worker for a status update on the home health referral and subsequently shares the Medical Assistant's visit window with the daughter to reduce her anxiety about the first day home."", ""ai_intended_category"": ""Proactive""}, {""rationale"": ""This is an overstep because the Navigator is prohibited from contacting home health vendors or driving the clinical referral process, which is the sole responsibility of the Social Worker."", ""description"": ""The Navigator calls the home health agency's intake department to ask if they have a nurse available for a Friday start-of-care to help Martha feel more secure about the timeline."", ""ai_intended_category"": ""Overstep""}]",,Home with Home Health Agency,e2f492a6-616c-41b3-96bf-cf48e01e9174,,Case_2,"Arthur, an eighty-one-year-old recovering from a stroke, was nearing his discharge date when his daughter, Martha, expressed overwhelming fear about her ability to manage his mobility needs at home. The Navigator observed this distress during a bedside visit and immediately documented the family's hesitation in Atlantis while explaining how the Healing Partners program provides a supportive bridge during the first twenty-four hours. By alerting the Social Worker to the daughter's panic, the Navigator ensured that a family meeting was prioritized, allowing the transition to proceed once the daughter felt heard by the clinical staff.",,,,,,"During the twenty-four-hour pulse call, I reached Martha, who reported that while she was still nervous, the family meeting with the Social Worker helped her feel more prepared for Arthur's return the following afternoon.","The Social Worker is responsible for selecting the home health agency and managing the clinical discharge timeline, while the Patient Navigator verifies demographic accuracy in Atlantis, educates the family on the Medical Assistant's first-day role, and flags caregiver anxiety to the clinical team.",,,,,I provided the Healing Partners flyer to Martha and assisted her in saving the V-Card to her contacts so she would recognize the caller ID for the initial coordination call.,v13
synthetic_cases,,True,"After the Social Worker verbally confirmed that the agency had processed the referral, I recorded the discharge date of October 18th in Atlantis and scheduled the medical assistant for the first home visit on the morning of October 19th.",,synthetic_batch_25_v13,,,,Success_Home_with_First_Visit,,,2026-03-25T12:40:36.824045+00:00,I performed a thorough audit of the facility face sheet against the Atlantis record and discovered that Arthur's home address was listed with an incorrect apartment number and his primary caregiver's cell phone was missing a digit; I updated these details in Atlantis to ensure no communication failures occur during the transition.,,,,"[{""edd_delta"": ""None"", ""clinical_impact"": ""Unchanged"", ""event_description"": ""The Social Worker informed me that Arthur is medically stable for discharge, but the home health agency has not yet accepted the referral; I documented this pending status in Atlantis and noted the potential delay."", ""environmental_impact"": ""Unchanged"", ""ai_assumed_bottleneck"": ""Clinical readiness achieved"", ""service_adoption_impact"": ""Unchanged""}, {""edd_delta"": ""+1\u20133 Days"", ""clinical_impact"": ""Unchanged"", ""event_description"": ""During a follow-up conversation, the Social Worker mentioned that the intake coordinator at the home health agency is out on emergency leave and no one is currently processing new admissions; I recorded this administrative gap in Atlantis and alerted the Social Worker to the family's growing concern."", ""environmental_impact"": ""Worsens"", ""ai_assumed_bottleneck"": ""Home health agency intake coordinator unavailable"", ""service_adoption_impact"": ""Negative""}, {""edd_delta"": ""None"", ""clinical_impact"": ""Unchanged"", ""event_description"": ""I met with the daughter to review the medical assistant's role while we wait for the agency; she shared that she is feeling overwhelmed by the lack of a firm date, which I documented as a readiness concern in Atlantis."", ""environmental_impact"": ""Unchanged"", ""ai_assumed_bottleneck"": ""Caregiver anxiety regarding transition timing"", ""service_adoption_impact"": ""Positive""}, {""edd_delta"": ""None"", ""clinical_impact"": ""Improves"", ""event_description"": ""The Social Worker called to confirm that a backup intake person at the agency has finally approved the case for Thursday; I updated Atlantis with the confirmed plan and began the final coordination for the medical assistant visit."", ""environmental_impact"": ""Improves"", ""ai_assumed_bottleneck"": ""Administrative bottleneck resolved"", ""service_adoption_impact"": ""Positive""}]","[{""situation"": ""The Social Worker reports that the home health agency is not responding to the referral due to a staffing absence in their intake office."", ""action_taken"": ""I documented the specific administrative bottleneck and the expected delay in the Atlantis timeline while waiting for the facility team to provide an update."", ""intent_category"": ""Flag""}, {""situation"": ""The patient's daughter asks for a specific list of which medications the home health nurse will be managing upon Arthur's arrival."", ""action_taken"": ""I explained that medication management is a clinical topic best discussed with the Social Worker and the nursing team, and I noted her question in Atlantis for my own records."", ""intent_category"": ""Educate""}, {""situation"": ""The facility face sheet shows a different primary phone number than what was originally entered in the Atlantis queue."", ""action_taken"": ""I audited the demographic data and corrected the phone number in Atlantis to ensure the home team can reach the family successfully."", ""intent_category"": ""Verify""}]","[{""rationale"": ""This respects the boundary that the Social Worker owns the discharge process and the Navigator does not drive the timeline or contact agencies directly."", ""description"": ""The Navigator notices the Social Worker has not provided an update on the agency status for 48 hours and chooses to document the lack of communication in Atlantis while waiting for the facility team to initiate the next step."", ""ai_intended_category"": ""Passive""}, {""rationale"": ""This allows the Navigator to gather necessary information through the appropriate channels and fulfill their education role without overstepping into clinical management."", ""description"": ""The Navigator asks the Social Worker for a verbal status update on the home health referral and then meets with the family to confirm they have the Healing Partners contact information saved and understand the medical assistant's role on day one."", ""ai_intended_category"": ""Proactive""}, {""rationale"": ""This is an overstep because the Navigator is strictly prohibited from contacting external vendors or agencies, as this responsibility belongs solely to the Social Worker."", ""description"": ""The Navigator calls the home health agency's intake department to explain that the patient has dementia and asks if they can assign a nurse immediately to prevent a discharge delay."", ""ai_intended_category"": ""Overstep""}]",,Home with 24-hour family supervision and home health support.,61534371-5f56-4194-b16a-45e6bab3f30e,,Case_3,"Arthur Vance, an 86-year-old patient living with dementia, was nearing discharge after recovering from a hip fracture sustained during a fall, but his transition was interrupted when the intake coordinator at the designated home health agency became unavailable. This administrative breakdown left Arthur's daughter anxious about the lack of a confirmed nursing schedule for her father's complex needs. The Navigator supported the family by explaining the Healing Partners transition model and the first-day medical assistant visit, while documenting the agency delay in Atlantis and waiting for the Social Worker to resolve the staffing bottleneck.",,,,,,"During the twenty-four-hour pulse call, I spoke with Arthur's daughter who confirmed they had prepared the home for his return, though she expressed significant worry about the agency's delay in assigning a nurse; I documented her sentiment in Atlantis and suggested she speak with the Social Worker for clinical updates.","The Social Worker is responsible for managing the clinical discharge timeline and coordinating with the home health agency intake team, while the Navigator focuses on verifying Arthur's contact information in Atlantis, educating the family on the medical assistant program, and flagging communication delays between the facility and the home health provider.",,,,,I sat with Arthur's daughter and helped her save the Healing Partners digital contact card to her phone so she would recognize our calls after discharge. I also provided a program flyer and explained that the medical assistant would be the first person to visit within the initial 24-hour window.,v13
synthetic_cases,,True,"After the social worker verbally confirmed that the home health agency had accepted the case and Arthur was cleared for discharge, the Navigator recorded the Friday discharge date and the Saturday morning Medical Assistant visit in Atlantis.",,synthetic_batch_25_v13,,,,Success_Home_with_First_Visit,,,2026-03-25T12:40:36.824045+00:00,"The Navigator audited the Atlantis queue against the facility face sheet and discovered that Arthur's home address was listed with an incorrect zip code. This error was corrected in Atlantis to prevent any logistical delays for the home health team, and the daughter's mobile number was verified as the primary point of contact.",,,,"[{""edd_delta"": ""+2\u20135 Days"", ""clinical_impact"": ""Unchanged"", ""event_description"": ""The Navigator met with Arthur\u2019s daughter, who reported that she had not yet been shown how to safely assist her father with transfers; the Navigator documented this training anxiety in Atlantis for the social worker's awareness."", ""environmental_impact"": ""Worsens"", ""ai_assumed_bottleneck"": ""Caregiver Training Gap"", ""service_adoption_impact"": ""Negative""}, {""edd_delta"": ""+2\u20135 Days"", ""clinical_impact"": ""Unchanged"", ""event_description"": ""The Navigator asked the social worker for a verbal status update on the home health referral; the social worker noted that while the referral was sent, they were still waiting for a response from the intake department."", ""environmental_impact"": ""Unchanged"", ""ai_assumed_bottleneck"": ""HHA_Acceptance_Stall"", ""service_adoption_impact"": ""Unchanged""}, {""edd_delta"": ""+2\u20135 Days"", ""clinical_impact"": ""Unchanged"", ""event_description"": ""The daughter contacted the Navigator stating she was still waiting for a training session; the Navigator advised her to speak directly with the social worker to schedule the demonstration and documented the conversation in Atlantis."", ""environmental_impact"": ""Worsens"", ""ai_assumed_bottleneck"": ""Family_Training_Gap_Anxiety"", ""service_adoption_impact"": ""Negative""}, {""edd_delta"": ""0"", ""clinical_impact"": ""Improves"", ""event_description"": ""The social worker notified the Navigator that the daughter's training was completed and the home health agency confirmed a Saturday start of care; the Navigator then updated Atlantis and scheduled the first Medical Assistant visit."", ""environmental_impact"": ""Improves"", ""ai_assumed_bottleneck"": ""None"", ""service_adoption_impact"": ""Positive""}]","[{""situation"": ""Arthur's daughter expressed fear regarding his Parkinson's tremors and how they might affect his safety at home."", ""action_taken"": ""The Navigator documented the sentiment in Atlantis and alerted the social worker to the family's need for a care conference."", ""intent_category"": ""Flag""}, {""situation"": ""The family was unsure of what to expect during the first day back at home."", ""action_taken"": ""The Navigator educated the daughter on the Medical Assistant's role and the importance of the twenty-four-hour post-discharge window."", ""intent_category"": ""Educate""}, {""situation"": ""The social worker had not yet provided a confirmed discharge date despite Arthur being clinically stable."", ""action_taken"": ""The Navigator noted the communication gap in the Atlantis timeline and waited for the social worker to provide a verbal update."", ""intent_category"": ""Verify""}]","[{""rationale"": ""The social worker owns the discharge process and agency selection; the Navigator must wait for information to be relayed rather than seeking it from external sources or clinical systems."", ""description"": ""The Navigator notes that the social worker has not yet confirmed which home health agency will be seeing Arthur and chooses to wait for a verbal update while recording the delay in Atlantis."", ""ai_intended_category"": ""Passive""}, {""rationale"": ""This action supports the family and keeps the social worker informed of barriers without crossing into clinical education or vendor management."", ""description"": ""The Navigator asks the social worker for an update on the daughter's training status and provides the daughter with a Healing Partners flyer to review while she waits for her bedside teaching session."", ""ai_intended_category"": ""Proactive""}, {""rationale"": ""This is an overstep because the Navigator is prohibited from contacting home health agencies directly and is attempting to influence clinical staffing and training, which is the social worker's responsibility."", ""description"": ""The Navigator calls the home health agency's intake coordinator to ask if they can prioritize Arthur's case and provide a nurse who specializes in Parkinson's care for the daughter's training."", ""ai_intended_category"": ""Overstep""}]",,Home,3170fcd5-ee61-4107-83b1-04835b8f71f8,,Case_4,"Arthur, an 82-year-old gentleman recovering from a urinary tract infection complicated by his Parkinson's symptoms, faced a significant hurdle to returning home when his daughter expressed overwhelming anxiety about managing his mobility. She felt unprepared to handle his specialized care needs, creating a friction point that threatened to delay his discharge from the facility. The Navigator acted as a supportive liaison by documenting the daughter's fears in Atlantis and ensuring the social worker was aware that a training gap needed to be addressed before the transition could safely occur.",,,,,,"During the twenty-four-hour pre-discharge call, the daughter confirmed that she had received a brief demonstration on mobility assistance from the facility staff and felt slightly more confident, though she was eagerly awaiting the arrival of the home health nurse and the Medical Assistant.","The social worker is responsible for selecting the home health agency and arranging clinical training for the daughter, while the Navigator manages demographic verification in Atlantis, provides education on the Healing Partners program, and alerts the social worker to the family's specific training anxieties.",,,,,The Navigator met with Arthur’s daughter and successfully helped her download the V-card onto her phone so she would recognize the Healing Partners caller ID; a program flyer was also provided to help her understand the role of the Medical Assistant during the first twenty-four hours at home.,v13
