source_table,ai_intended_category,atlantis_entry_confirmed,atlantis_final_sync,authenticity_reasoning,batch_id,bottleneck_realism,case_id,case_label,case_outcome,clinical_impact,completed_at,created_at,demographic_audit_note,edd_delta,environmental_impact,event_index,format_1_state_log,format_2_triples,format_3_rl_scenario,home_service_adoption_impact,home_vs_ltc_determination,id,improvement_suggestion,label,ma_visit_booking,narrative_summary,navigator_id,navigator_name,option_index,overall_field_authenticity,pn_category,pre_dc_pulse_call_result,session_id,status,tactical_viability_score,triple_index,v_card_and_flyer_status,version,weekly_facility_update
synthetic_cases,,True,Entered D/C date of 05/19 and 1st visit date of 05/20 into the Atlantis tracking module.,,synthetic_batch_25_v5,,,,Success_Home_with_First_Visit,,,2026-03-05T21:57:34.15135+00:00,Audited Atlantis demographics; corrected the primary phone number from a landline to the daughter's mobile. Verified Straight Medicare coverage and confirmed the home address in the renal-friendly zip code matches the SNF face sheet.,,,,"[{""edd_delta"": ""+2\u20137 Days"", ""clinical_impact"": ""Unchanged"", ""event_description"": ""Family Disagreement on Discharge Plan regarding home dialysis safety."", ""environmental_impact"": ""Worsens"", ""ai_assumed_bottleneck"": ""Family/Caregiver"", ""service_adoption_impact"": ""Negative""}, {""edd_delta"": ""+1\u20133 Days"", ""clinical_impact"": ""Worsens"", ""event_description"": ""HHA_SOC_Overlap: Difficulty finding a nurse certified for Martha's specific dialysis fistula care."", ""environmental_impact"": ""Unchanged"", ""ai_assumed_bottleneck"": ""Operational"", ""service_adoption_impact"": ""Negative""}, {""edd_delta"": ""+2\u20134 Days"", ""clinical_impact"": ""Worsens"", ""event_description"": ""Friday Discharge Gap: Facility pushed discharge to Friday afternoon, risking a weekend without monitoring."", ""environmental_impact"": ""Neutral"", ""ai_assumed_bottleneck"": ""Operational"", ""service_adoption_impact"": ""Negative""}]","[{""situation"": ""The patient's son demands a cost-benefit analysis of home care versus a long-term care facility."", ""action_taken"": ""PN educated the family on the program benefits and safety monitoring while deferring financial comparisons to the Social Worker."", ""intent_detail"": ""Educating on program expectations"", ""intent_category"": ""Educate""}, {""situation"": ""Son threatens to block the transport company from taking the patient home."", ""action_taken"": ""PN flagged the volatile family situation to the Social Worker for immediate intervention and a formal family meeting."", ""intent_detail"": ""Escalating to SW for resolution"", ""intent_category"": ""Escalate""}, {""situation"": ""The HHA coordinator is uncertain if they can staff the Saturday morning visit for a Friday discharge."", ""action_taken"": ""PN verified HHA receipt of the referral and confirmed the assigned nurse name and first-visit time window for the MA to follow."", ""intent_detail"": ""Verifying logistics and data accuracy"", ""intent_category"": ""Verify""}]","[{""rationale"": ""Respects the SW boundary and ensures the PN does not overstep into placement decisions or financial counseling."", ""description"": ""Step back from the family conflict to allow the Social Worker to lead the multidisciplinary meeting regarding the son's preference for LTC."", ""ai_intended_category"": ""Passive""}, {""rationale"": ""Follows the Stage 2 Patient Education checklist to reduce caregiver anxiety and ensure service adoption."", ""description"": ""Walk the daughter through the Day 1 expectations, specifically explaining who will arrive and how the MA will assist the HHA nurse in the 24-hour window."", ""ai_intended_category"": ""Proactive""}, {""rationale"": ""This violates the Banned Actions regarding providing cost analysis and handling financial cliff discussions."", ""description"": ""Provide the son with a detailed cost analysis showing that home care is more affordable than the 100-day private pay rate at a local LTC facility."", ""ai_intended_category"": ""Overstep""}]",,"SW confirms the goal is Home, though the patient's son is currently advocating for LTC placement due to the complexity of the dialysis regimen.",9df4378a-f66e-40c3-9857-24fdb1769a33,,Case_1,"Medical Assistant visit scheduled for 05/20 at 09:00 AM, ensuring the 24-hour post-discharge window is met.","Martha G. was identified in Atlantis as a renal failure transition requiring complex home monitoring. During the maintenance phase, a significant family disagreement emerged between the daughter (pro-home) and the son (pro-LTC), which I escalated to the SW for mediation. Once the SW finalized the home plan, I conducted the pulse call to verify logistics and successfully scheduled the MA for the morning after discharge to secure the first-visit incentive.",,,,,,"Reached the daughter (POA); she confirms the home is ready and she will be present for the transition. Son's concerns remain, but the SW has cleared the discharge to the daughter's care.",,,,,V-Card successfully inserted into the patient's tablet; 'Home Care vs. SNF' program flyer delivered to both the patient and the daughter during the bedside visit.,v5,"Week 2: SW reports the patient is clinically stable, but the discharge timeline is fluid due to the son's refusal to sign off on the home plan. PN requested a post-conference summary from the SW."
synthetic_cases,,True,Entered D/C date of 10/27/2023 and 1st Visit Date of 10/28/2023 into Atlantis after SW confirmed the DME swap was expedited.,,synthetic_batch_25_v5,,,,Success_Home_with_First_Visit,,,2026-03-05T21:57:34.15135+00:00,Audited Atlantis queue against facility face sheet; corrected DOB from 05/12/1954 to 05/12/1955. Confirmed Medicare Advantage PPO eligibility and verified home address in the 19104 zip code for MA travel distance.,,,,"[{""edd_delta"": ""N/A"", ""clinical_impact"": ""Unchanged"", ""event_description"": ""Initial Atlantis Triage and Demographic Audit"", ""environmental_impact"": ""Unchanged"", ""ai_assumed_bottleneck"": ""Administrative"", ""service_adoption_impact"": ""Positive""}, {""edd_delta"": ""+3\u20137 Days"", ""clinical_impact"": ""Worsens"", ""event_description"": ""DME Vendor delivers manual bed instead of semi-electric model"", ""environmental_impact"": ""Worsens"", ""ai_assumed_bottleneck"": ""Logistical"", ""service_adoption_impact"": ""Negative""}, {""edd_delta"": ""0 Days"", ""clinical_impact"": ""Improves"", ""event_description"": ""SW coordinates expedited equipment swap; PN verifies delivery at home"", ""environmental_impact"": ""Improves"", ""ai_assumed_bottleneck"": ""Operational"", ""service_adoption_impact"": ""Positive""}]","[{""situation"": ""Daughter reports wrong bed type arrived at the residence during pulse call."", ""action_taken"": ""Immediately flagged the specific equipment mismatch to the SW to prevent an unsafe discharge."", ""intent_detail"": ""Escalating to SW for resolution"", ""intent_category"": ""Escalate""}, {""situation"": ""Patient's daughter is unsure how to handle the first 24 hours post-discharge."", ""action_taken"": ""Walked the family through the Day 1 checklist, including MA arrival time and wound care supply verification."", ""intent_detail"": ""Educating on program expectations"", ""intent_category"": ""Educate""}, {""situation"": ""Atlantis record shows an outdated phone number for the primary caregiver."", ""action_taken"": ""Updated the Atlantis demographic fields with the daughter's current mobile number after verifying the face sheet."", ""intent_detail"": ""Verifying logistics and data accuracy"", ""intent_category"": ""Verify""}]","[{""rationale"": ""This follows the SW boundary by allowing the facility professional to manage the logistics of the equipment vendor while the PN remains in a monitoring stance for the final handoff."", ""description"": ""Wait for the Social Worker to receive confirmation from the DME vendor regarding the replacement bed delivery before updating the Atlantis transition record."", ""ai_intended_category"": ""Passive""}, {""rationale"": ""This aligns with the Stage 3 Scheduling Anchor, ensuring the environment is safe before the 'First Visit' incentive is triggered."", ""description"": ""Verify the specific delivery window for the replacement bed with the family and ensure the MA visit is scheduled only after the equipment is confirmed to be in place."", ""ai_intended_category"": ""Proactive""}, {""rationale"": ""This is an overstep because it involves managing vendor relationships and suggesting specific providers, which falls under the SW's exclusive domain."", ""description"": ""Call the DME company directly to demand an upgrade to a higher-tier air mattress and suggest the SW switch to a different vendor that provides faster service."", ""ai_intended_category"": ""Overstep""}]",,Social Worker Maria confirmed the goal is Home with HHA services for daily diabetic wound dressing changes and PT for gait training.,a76b5d61-ba2d-4717-97f4-167602c1aa3e,,Case_2,"Medical Assistant scheduled for 10/28/2023 at 11:00 AM, following the HHA's confirmed Start of Care window to ensure clinical continuity.","In Stage 1, I audited demographic errors in Atlantis and confirmed the home discharge goal with the SW. During Stage 2, I maintained weekly check-ins and educated the family, which proved critical when the daughter identified a DME delivery failure during my 24-hour pulse call. I successfully escalated the equipment mismatch to the SW, allowing for a corrected delivery before finalizing the Stage 3 handoff and scheduling the MA first visit.",,,,,,"Reached daughter via phone 24 hours prior to discharge. Daughter reported that the DME vendor delivered a standard manual bed instead of the prescribed semi-electric model with a pressure-reduction mattress, creating a safety risk for the patient's diabetic ulcers.",,,,,PN V-Card successfully inserted into patient's contact list; physical program flyer delivered to the patient's daughter during the bedside education session.,v5,"Week 2: Wound healing is stable; SW confirms target discharge for Friday. Patient remains a high fall risk, requiring a hospital bed and O2 concentrator at home before transition."
synthetic_cases,,True,Entered discharge date of 10/27 and first home visit date of 10/28 into Atlantis portal.,,synthetic_batch_25_v5,,,,Success_Home_with_First_Visit,,,2026-03-05T21:57:34.15135+00:00,Audited face sheet against Atlantis queue; corrected patient address from 402 Oak Street to 402 Oak Avenue and verified Straight Medicare eligibility for post-acute benefits.,,,,"[{""edd_delta"": ""+1\u20133 Days"", ""clinical_impact"": ""Unchanged"", ""event_description"": ""Atlantis Data Audit"", ""environmental_impact"": ""Unchanged"", ""ai_assumed_bottleneck"": ""Administrative"", ""service_adoption_impact"": ""Positive""}, {""edd_delta"": ""+1\u20133 Days"", ""clinical_impact"": ""Unchanged"", ""event_description"": ""HHA Scheduling Conflict"", ""environmental_impact"": ""Unchanged"", ""ai_assumed_bottleneck"": ""Operational"", ""service_adoption_impact"": ""Negative""}]","[{""situation"": ""Patient address in Atlantis does not match the facility face sheet."", ""action_taken"": ""Updated demographics in Atlantis to ensure the HHA and MA have the correct navigation data."", ""intent_detail"": ""Verifying logistics and data accuracy"", ""intent_category"": ""Verify""}, {""situation"": ""Family is unsure what to do if the HHA nurse does not arrive on the first day."", ""action_taken"": ""Educated the daughter on 'Day 1' expectations, including the role of the MA and who to contact if the HHA is delayed."", ""intent_detail"": ""Educating on program expectations"", ""intent_category"": ""Educate""}, {""situation"": ""HHA intake coordinator indicates staffing constraints may push the first visit to Monday."", ""action_taken"": ""Escalated the potential weekend coverage gap to the Social Worker to determine if the discharge date should be adjusted."", ""intent_detail"": ""Escalating to SW for resolution"", ""intent_category"": ""Escalate""}]","[{""rationale"": ""PN respects the SW's role in agency selection and scheduling, avoiding premature coordination until the clinical handoff is settled."", ""description"": ""Wait for the Social Worker to resolve the HHA scheduling conflict before finalizing the MA visit time in the Atlantis system."", ""ai_intended_category"": ""Passive""}, {""rationale"": ""PN fulfills the Stage 3 requirement of scheduling the MA within 24 hours and educating the family, while staying within the communication boundary of the SW."", ""description"": ""Schedule the Medical Assistant for a Saturday morning visit and provide the family with a physical appointment card, while flagging the HHA staffing overlap to the SW for awareness."", ""ai_intended_category"": ""Proactive""}, {""rationale"": ""PN interferes with HHA operations and attempts to handle clinical documentation (F2F), both of which are banned actions."", ""description"": ""Contact the HHA directly to suggest they prioritize this patient over others to ensure the 24-hour visit window is met, and offer to assist with the Face-to-Face form to speed up intake."", ""ai_intended_category"": ""Overstep""}]",,Social Worker confirmed the discharge goal is Home with HHA services following successful ORIF recovery.,116fac9f-76d6-428f-8c5c-9197af9ac52e,,Case_3,"Medical Assistant visit scheduled for 10/28 at 10:00 AM, within the mandatory 24-hour post-discharge window.","The PN initiated the case by auditing demographics in Atlantis and confirming a home discharge goal for a 72-year-old hip fracture patient. During the maintenance phase, the PN educated the family on the transition process and verified home readiness through a pulse call. Despite an HHA staffing overlap that threatened the initial visit window, the PN successfully coordinated the MA schedule and secured the first visit incentive.",,,,,,"Pulse call completed 24 hours prior to discharge; daughter confirmed the ramp is clear and the hospital bed was delivered, but expressed concern about the HHA's arrival time.",,,,,V-Card successfully inserted into patient's smartphone and physical program flyer delivered to daughter during bedside education session.,v5,"Week 2 Check-in: SW reports PT progress is excellent; patient is ambulating 50 feet with a walker. Targeted discharge is Friday, pending final surgical clearance."
synthetic_cases,,True,D/C Date: 11/15/2024; First Visit Date: 11/16/2024. All dates synced in Atlantis to trigger the MA workflow.,,synthetic_batch_25_v5,,,,Success_Home_with_First_Visit,,,2026-03-05T21:57:34.15135+00:00,Verified Medicare Advantage (Aetna) and confirmed address in Atlantis matches the SNF face sheet. Discovered the phone number listed was a disconnected landline; updated Atlantis with the patient's current cell phone number and her daughter's (POA) contact info.,,,,"[{""edd_delta"": ""+3\u20135 Days"", ""clinical_impact"": ""Unchanged"", ""event_description"": ""HHA Oncology Specialist reports flu; intake department is scrambling for coverage."", ""environmental_impact"": ""Worsens"", ""ai_assumed_bottleneck"": ""Operational"", ""service_adoption_impact"": ""Negative""}, {""edd_delta"": ""+1\u20133 Days"", ""clinical_impact"": ""Unchanged"", ""event_description"": ""Atlantis data sync reveals mismatch in patient primary phone number."", ""environmental_impact"": ""Unchanged"", ""ai_assumed_bottleneck"": ""Administrative"", ""service_adoption_impact"": ""Negative""}]","[{""situation"": ""HHA intake coordinator reports the assigned nurse is out sick and cannot perform the Start of Care on the discharge day."", ""action_taken"": ""Escalated the coverage gap to the Social Worker to determine if a generalist HHA nurse could bridge the gap or if the discharge date should be adjusted."", ""intent_detail"": ""Verifying logistics and data accuracy"", ""intent_category"": ""Verify""}, {""situation"": ""Martha's daughter expressed confusion about the difference between the HHA nurse and the program's Medical Assistant."", ""action_taken"": ""Conducted a family education session explaining that the MA provides an extra layer of safety within 24 hours, while the HHA handles clinical wound/medication management."", ""intent_detail"": ""Educating on program expectations"", ""intent_category"": ""Educate""}, {""situation"": ""The facility EMR shows a different discharge date than the SW's verbal update."", ""action_taken"": ""Checked in with the SW to confirm the finalized date before updating the Atlantis record and scheduling the MA."", ""intent_detail"": ""Verifying logistics and data accuracy"", ""intent_category"": ""Verify""}]","[{""rationale"": ""Respects the SW Boundary; the PN does not manage HHA staffing or coordinate agency-level clinical coverage."", ""description"": ""Step back and allow the Social Worker to contact the HHA to resolve the staffing shortage or find a replacement nurse."", ""ai_intended_category"": ""Passive""}, {""rationale"": ""Complies with Stage 3 Handoff rules and the Scheduling Anchor, ensuring the PN's 'First Visit' incentive is secured through the MA."", ""description"": ""Verify the HHA has a confirmed Start-of-Care date and schedule the MA visit for the morning after discharge to ensure the patient is not alone during the provider's illness gap."", ""ai_intended_category"": ""Proactive""}, {""rationale"": ""Banned Action: Suggesting specific HHA agencies to the SW or interfering with the agency selection process is a direct overstep of the PN role."", ""description"": ""Call a different HHA that you have a personal relationship with and ask them to take the case since the current HHA has a sick nurse."", ""ai_intended_category"": ""Overstep""}]",,Social Worker confirmed the goal is Home with Home Health Agency (HHA) support for post-chemo weakness and medication management.,8783a98e-9bdb-4939-a1db-19d977706fc4,,Case_4,MA scheduled for 11/16/2024 at 09:30 AM. Physical appointment card with the MA's name and the Care Coordinator's phone number was handed to Martha.,"Martha was triaged in Atlantis following post-chemo rehab, where I corrected her contact information and confirmed a home-bound goal with the SW. During the maintenance phase, I provided program education and inserted my V-card, though a delay was introduced when the HHA's lead nurse fell ill. I completed the 24-hour pulse call to Martha's daughter and successfully scheduled the MA visit within the required window to ensure a safe transition despite the HHA's staffing gap.",,,,,,"Reached Martha's daughter 24 hours prior to discharge. Confirmed the home is prepared with groceries and meds, but the HHA intake coordinator notified us that the primary oncology nurse is out with the flu.",,,,,V-Card inserted into Martha's iPhone; physical 'Safe Transition' flyer delivered to Martha and her daughter during the bedside education session.,v5,"Week 2: Patient is meeting PT goals for gait stability. SW indicates discharge is targeted for Friday, pending the final oncology clearance. PN educated the family on the Medical Assistant (MA) 'First Visit' role."
synthetic_cases,,True,D/C date adjusted to 11/18; 1st visit date 11/19 entered into Atlantis following DME resolution.,,synthetic_batch_25_v5,,,,Success_Home_with_First_Visit,,,2026-03-05T21:57:34.15135+00:00,Audited Atlantis demographics against Northcrest face sheet; corrected patient's zip code and added daughter's secondary mobile number. Verified Medicare Advantage PPO eligibility.,,,,"[{""edd_delta"": ""+3\u20137 Days"", ""clinical_impact"": ""Unchanged"", ""event_description"": ""DME_Delivery_Failure: Hospital bed arrived incomplete (no mattress/rails)."", ""environmental_impact"": ""Worsens"", ""ai_assumed_bottleneck"": ""Logistical"", ""service_adoption_impact"": ""Negative""}, {""edd_delta"": ""0 Days"", ""clinical_impact"": ""Unchanged"", ""event_description"": ""PN verifies correct DME setup via photo confirmation from daughter."", ""environmental_impact"": ""Improves"", ""ai_assumed_bottleneck"": ""Operational"", ""service_adoption_impact"": ""Positive""}]","[{""situation"": ""Daughter reports incomplete hospital bed delivery during pulse call."", ""action_taken"": ""Immediately flagged the DME mismatch to the Social Worker and HHA intake coordinator."", ""intent_detail"": ""Escalating to SW for resolution"", ""intent_category"": ""Escalate""}, {""situation"": ""Patient's daughter expresses anxiety about managing the O2 concentrator."", ""action_taken"": ""Walked family through Day 1 expectations, including who to call if the HHA nurse is delayed."", ""intent_detail"": ""Educating on program expectations"", ""intent_category"": ""Educate""}, {""situation"": ""Discharge date shifted due to DME delay."", ""action_taken"": ""Updated Atlantis D/C and First Visit dates to align with the new 24-hour window."", ""intent_detail"": ""Verifying logistics and data accuracy"", ""intent_category"": ""Verify""}]","[{""rationale"": ""Respects the SW boundary as the primary coordinator of facility-ordered equipment and discharge timing."", ""description"": ""Wait for the Social Worker to provide a new confirmed discharge date after they resolve the DME issue with the vendor."", ""ai_intended_category"": ""Passive""}, {""rationale"": ""Aligned with Stage 3 checklist for HHA/Team Handoff and de-conflicting the schedule to protect the 24-hour visit window."", ""description"": ""Coordinate with the HHA intake coordinator to put the start-of-care visit on 'standby' and verify they have the capacity to shift the visit to the following Monday if the DME is not fixed by Friday."", ""ai_intended_category"": ""Proactive""}, {""rationale"": ""Oversteps into SW territory (finding agencies/vendors) and clinical medication/equipment management."", ""description"": ""Call the DME vendor directly to provide clinical justification for an emergency mattress delivery and suggest a different vendor to the SW if they cannot deliver today."", ""ai_intended_category"": ""Overstep""}]",,SW confirms the goal is Home with HHA support; patient has strong family involvement but requires a hospital bed and O2.,2ee878e6-cac4-46f6-b7ae-5d71b8e5ff78,,Case_5,MA scheduled for 11/19 at 09:00 AM to ensure visit occurs within 24 hours of the rescheduled discharge.,"Patient was triaged in Atlantis and confirmed for home discharge with HHA services. During the maintenance phase, education was provided to the family and contact info was exchanged. A significant DME delivery failure was identified during the 24-hour pulse call, requiring a 3-day discharge delay which the PN communicated to the home team. Once the correct equipment was verified at the home, the MA visit was successfully scheduled for the morning after discharge.",,,,,,Pulse call conducted 24h prior to D/C. Daughter reports 'DME Failure': the hospital bed arrived but is missing the mattress and side rails. Home is currently unsafe for transition.,,,,,V-Card inserted into patient's phone; program flyer delivered to daughter (POA) during bedside education session on Day 1 expectations.,v5,Week 2 Check-in: SW reports patient is stable post-chemo rehab. PT goals met for transfers. Discharge target set for Friday. DME vendor confirmed for Thursday delivery.
